instructions,ingredients,title
"Preheat oven to 425 degrees F.
Coarsely grind caraway seeds with salt in an electric coffee/spice grinder or crush with a rolling pin. Mince garlic, then mash to a paste with salt mixture using flat side of a chef's knife. Transfer paste to a large bowl and whisk in honey, lemon juice, oil, spices, and pepper.
Put zucchini, turnips, bell peppers, butternut squash, and onions in an oiled large roasting pan, then add half of spice mixture and toss until well coated. Stir tomatoes and broth into vegetables. Add hens to large bowl with remaining spice mixture and toss to coat, then arrange hens, breast sides up, over vegetables in pan.
Cover pan tightly with foil and roast in middle of oven 15 minutes. Uncover and roast until hens are browned and vegetables are tender, 45 minutes more. Skim fat from cooking liquid. Sprinkle herbs on top and spoon some cooking liquid over hens.","['1 teaspoon caraway seeds', '1 1/2 tablespoons salt', '4 garlic cloves', '1/4 cup mild honey', '1/4 cup fresh lemon juice', '2 tablespoons olive oil', '2 tablespoons paprika', '4 teaspoons ground cumin', '2 teaspoons ground ginger', '1 1/2 teaspoons ground cinnamon', '1/2 teaspoon cayenne', '1 teaspoon ground black pepper', '2 large zucchini (1 1/4 pounds total), halved lengthwise and cut into 1/2-inch pieces', '2 medium turnips (1/2 pound total), peeled, halved lengthwise, and cut crosswise into 3/4-inch pieces', '2 red bell peppers, quartered and cut into 1-inch pieces', '1 1/2 pounds butternut squash, peeled, seeded, and cut into 3/4-inch cubes', '2 medium onions, cut lengthwise into 1-inch-thick wedges', '1 (28-ounces) can whole tomatoes, drained and chopped', '1/2 cup chicken broth', '4 (1 1/4 to 1 1/2-pound) Cornish hens, halved lengthwise', '2 tablespoons chopped fresh parsley', '2 tablespoons chopped fresh cilantro', '2 tablespoons chopped fresh mint', 'Serving suggestion: cooked couscous']",Moroccan-Style Roast Cornish Hens with Vegetables
"Combine the tomatoes, chicken broth, apricots, onion and butter in a 7-to-8-quart slow cooker. Add 2 minced garlic cloves, 1 teaspoon molasses, 1 teaspoon paprika, 1/2 teaspoon pie spice, the lemon juice, 3/4 cup cilantro, 1/2 teaspoon salt and a few grinds of black pepper. Cover and set on high.
Combine the turkey, breadcrumbs, creme fraiche, parsley and the remaining 1/4 cup cilantro, 1 minced garlic clove, 2 teaspoons paprika and 1/2 teaspoon pumpkin pie spice in a large bowl. Add the cayenne, 1 teaspoon salt and a few grinds of black pepper and mix with a spoon or your hands. Dampen your hands and form the mixture into about 32 meatballs, 1 1/2 inches each. Place the meatballs in a single layer in the slow cooker, nestling them in the sauce. Cover and cook on high, 3 hours.
Just before serving, drizzle the meatballs with the remaining 1 tablespoon pomegranate molasses. Sprinkle with pomegranate seeds and scallions.
Photograph by Andrew Purcell","['1 14-ounce can diced tomatoes', '1/2 cup low-sodium chicken broth', '1/2 cup chopped dried apricots', '1 onion, grated', '2 tablespoons unsalted butter', '3 cloves garlic, minced', '1 tablespoon plus 1 teaspoon pomegranate molasses', '1 tablespoon paprika', '1 teaspoon pumpkin pie spice Juice of 1/2 lemon', '1 cup chopped fresh cilantro Kosher salt and freshly ground black pepper', '1 3/4 pounds lean ground turkey', '1/2 cup breadcrumbs', '2 tablespoons creme fraeche or heavy cream', '1/4 cup chopped fresh parsley', '1/4 teaspoon cayenne pepper', 'Pomegranate seeds and sliced scallions, for topping']",Slow-Cooker Moroccan Turkey Meatballs
"Place a large high-sided saute pan over medium heat with the oil. Add the onion and garlic to the pan and cook, stirring often, until just tender, 3 to 4 minutes. Add the tandoori spice, cinnamon and tomato paste to the pan and continue cooking until caramelized and very aromatic, about 2 minutes.
Add the chicken stock, tomatoes, lentils and honey and bring the liquid up to a boil while scraping any caramelized bits up from the bottom of the pan. Reduce the heat to medium-low and simmer until the lentils are almost cooked through, about 10 minutes. Add the green beans, chicken and lemon zest to the pan and continue cooking until the lentils and beans are cooked through, 2 to 3 minutes. Season with salt and pepper.
Serve the stew over steamed white rice garnished with cilantro.","['2 tablespoons olive or vegetable oil', '1 small onion, finely chopped', '3 cloves garlic, thinly sliced', '1 tablespoon tandoori spice', '3/4 teaspoon ground cinnamon', '1 tablespoon tomato paste', '2 cups chicken stock', 'One 28-ounce can whole peeled tomatoes, lightly crushed', '1 cup red lentils', '1 tablespoon honey', '1/2 pound green beans, stems trimmed, cut into 1-inch pieces', '3 to 4 cups shredded chicken (from 1 rotisserie chicken)', 'Zest of 1 lemon', 'Salt and ground black pepper', '4 cups steamed white rice, such as Jasmine', 'Chopped fresh cilantro, to garnish']",Moroccan Chicken Stew with Green Beans
"Watch how to make this recipe.
Preheat the oven to 400 degrees F. Line a baking sheet with parchment paper.
Pat the chickpeas dry between two paper towels then place on the baking sheet. Drizzle with the olive oil then roast the chickpeas in the middle of the oven, tossing every 15 minutes, until deeply golden, dry and crunchy, 40 to 45 minutes.
While the chickpeas roast, prepare the spice mixture: combine the cumin, brown sugar, cayenne, cinnamon, garlic, ginger, paprika and salt in a medium bowl. Mix until the color is uniform. As soon as the chickpeas come out of the oven, toss with the spice blend. Serve warm or at room temperature.","['One 15.5-ounce can low-sodium chickpeas, drained and rinsed', '1 tablespoon olive oil', '1/2 teaspoon ground cumin', '1/2 teaspoon light brown sugar', '1/4 teaspoon cayenne', '1/4 teaspoon ground cinnamon', '1/4 teaspoon garlic powder', '1/4 teaspoon ground ginger', '1/4 teaspoon paprika', '1/4 teaspoon kosher salt']",Moroccan Spiced Roast Chickpeas
"Preheat the oven to 325 degrees F.
In a medium bowl, add the meat, 1 small onion, grated on box grater or with handheld flat grater, directly over mixing bowl. Add 2 cloves finely chopped garlic, panko, about 2 tablespoons of the extra-virgin olive oil, the egg, the zest and juice of 1 lemon. Mix to combine. Add the olives, spices, a handful of parsley and a handful of mint. Combine well. Form the mixture into 4 individual rolls and bake on a parchment lined sheet pan until golden brown, about 35 to 40 minutes. The meat loaves may be made ahead and stored; reheat in pan gravy.
Heat a medium shallow pot over medium heat, add 2 tablespoons butter and melt, then add the remaining garlic, and combine. Stir in the zucchini, season with salt and pepper, to taste, and cook for 5 minutes. Add 1 1/2 cups stock to the pan and bring the mixture to a bubble. Add 1 1/2 cups of couscous and remaining handful of chopped mint. Turn off the heat and cover pan. Let stand for 5 minutes, then fluff with a fork.
Meanwhile, heat 2 tablespoons butter to a medium skillet over medium to medium-high heat. Whisk the flour into melted butter, then add the Worcestershire sauce and remaining 1 cup of chicken stock, the remaining lemon zest and juice, 1/4 cup honey, and salt and pepper, to taste. Slide the meat loaves into the sauce. (If the meat loaves are cold, tent with foil and gently reheat in low simmering sauce.) Once the meat loaves are warm, transfer them to a serving plate and raise the heat to high. As soon as the sauce becomes syrupy after 1 to 2 minutes, drizzle it over meat and serve with couscous alongside.","['1 1/2 pounds ground lamb or chicken', 'Salt and freshly ground black pepper', '1 small onion, peeled', '4 cloves garlic, finely chopped', '2/3 cup panko bread crumbs', '2 tablespoons extra-virgin olive oil', '1 large egg, beaten', '2 lemons, zested and juiced', '1/4 cup pitted, finely chopped green olives', '1 tablespoon ground cumin, a scant palmful', '1 teaspoon turmeric, 1/3 palmful (for chicken only)', '2 pinches ground cinnamon', 'A handful flat-leaf parsley, finely chopped', '2 handfuls fresh mint leaves, finely chopped', '4 tablespoons butter', '1/2 pound firm zucchini, chopped into small dice', '2 1/2 cups chicken stock', '1 cup couscous', '2 tablespoons all-purpose flour', '1 tablespoon Worcestershire sauce', '1/4 cup honey']",Moroccan Meatloaf with Lemon Honey Gravy and Zucchini Couscous
"Preheat the oven to 400 degrees F. Make the broth: Combine the turmeric, ginger, cinnamon, saffron and 1/2 teaspoon pepper in a medium saucepan over medium heat; toast, stirring, 1 minute. Add 2 1/2 cups water, the vegetable juice and harissa. Bring to a simmer and cook until slightly reduced, about 15 minutes; remove from the heat.
Prepare the vegetables: Combine the squash, turnips, celery, onion and raisins in a bowl; season with salt. Add 1 cup of the broth and half each of the cilantro and parsley; stir. Set aside the remaining broth.
Tear off four 16-inch sheets of parchment paper. Make the packets (see photo gallery): Arrange about one-quarter of the vegetable mixture on one sheet of parchment along with some of the liquid from the bowl. Top with 2 shiitakes, 2 bell pepper halves, 2 lemon pieces and 1 tablespoon butter. Seal as directed. Repeat to make 3 more packets; divide between 2 baking sheets.
Transfer to the oven and bake until the parchment puffs and the vegetables are tender, 35 to 40 minutes. Let rest 5 minutes before opening.
Meanwhile, prepare the couscous as the label directs; fluff with a fork. Bring the remaining broth to a simmer; stir in the remaining cilantro and parsley. Carefully open the packets; add the couscous, drizzle with the broth and season with salt. Photograph by David Malosh","['1/2 teaspoon ground turmeric', '1/2 teaspoon ground ginger', '1/2 teaspoon ground cinnamon', 'Pinch of saffron threads', 'Freshly ground pepper', '1 1/2 cups low-sodium vegetable juice', '2 teaspoons harissa (or 1/2 red jalapeno pepper, seeded and minced)', '1 1/4 pounds kabocha or butternut squash (about 1/2 large), peeled, seeded and cut into 1-inch cubes (about 4 cups)', '2 bunches baby turnips (about 12), trimmed and halved', '2 stalks celery, thinly sliced', '1 onion, cut into thin wedges', '1/2 cup raisins', 'Kosher salt', '3 tablespoons chopped fresh cilantro', '3 tablespoons chopped fresh parsley', '8 shiitake mushrooms, stemmed', '4 baby bell peppers, halved lengthwise', '4 thin slices lemon, halved', '4 tablespoons unsalted butter', '1 cup couscous']",Moroccan Vegetable Packets
"For the couscous: Preheat the oven to 400 degrees.Place the water in an ovenproof casserole. Whisk the curry, salt pepper into the water. Whisk the couscous into the water. Let the couscous stand for 10 minutes to absorb the water.
Pour half of the olive oil into the couscous. Work the olive oil into the couscous by hand, rubbing the kernels to fluff the couscous break up any clumps, making sure that the couscous is evenly coated with the oil. Place the casserole into the oven and bake for 20 minutes.
Remove the casserole from the oven and pour the rest of the oil into the couscous. By hand or with a spoon, work the oil through the couscous, breaking up any clumps.
For the raita: Place the yogurt, mint, cumin, salt and cucumbers in a bowl and stir to combine. Check the seasoning and adjust if necessary. Refrigerate until time to use.
For the vinaigrette: Place the oil, lemon juice, cilantro, parsley, garlic, cumin, paprika and cayenne in a bowl and stir to combine. Season the charmoula with salt and pepper.
For the kebabs: Combine the beef, onions, powdered milk, cilantro, mint, ginger, cayenne, salt and pepper in a bowl and mix thoroughly to combine. Divide the mixture into 8 balls. Form each ball into a kebab cylinder about 3 inches long. Refrigerate the kebabs until ready to grill.
In the meantime soak, wooden skewers in water. Heat the grill to high heat. Insert the skewers into the kebabs. Brush the kebabs with olive oil and grill until they are cooked, 34 minutes per side.
To complete the dish, place a mound of couscous on a serving plate for each person. Place 2 kebabs on each plate. Garnish the plate with the raita and drizzle the charmoula on the kebabs. Serve with warm pita bread.","['2 1/2 cups warm water', '1 tablespoon curry powder', '1/2 teaspoon salt', '1/4 teaspoon ground black pepper', '2 1/2 cups fine couscous', '3 tablespoons olive oil', '1 cup Greek yogurt', '1 tablespoon minced fresh mint', '1/2 teaspoon ground cumin', '1/4 teaspoon salt', '1 small English cucumber, peeled, seeded, diced', '1/2 cup olive oil', '1/4 cup lemon juice', '1/4 cup chopped fresh cilantro', '1/4 cup chopped fresh parsley', '1 tablespoon minced garlic', '1 teaspoon ground cumin', '1/2 teaspoon paprika', '1/4 teaspoon cayenne', 'Salt and freshly ground black pepper', '1 1/2 pounds ground beef', '1/2 cup finely minced red onion', '2 ounces nonfat powdered milk', '2 tablespoons chopped fresh cilantro', '2 tablespoons chopped fresh mint', '1 tablespoon ground ginger', '1 teaspoon cayenne', '1/2 teaspoon salt', '1/2 teaspoon freshly ground pepper', 'Olive oil, for brushing', 'Pita bread, warmed, for serving']","Moroccan Beef Kebabs with Curried Couscous, Raita and Charmoula Vinaigrette"
"Toast the almonds in a large dry skillet over medium heat, stirring occasionally, until golden, 3 to 5 minutes. Transfer to a plate; let cool.
Return the skillet to medium heat. Add 2 tablespoons olive oil, then add the carrots, apricots and 3/4 cup water. Reduce the heat to medium low; cover and simmer until the carrots are just tender, 8 to 10 minutes. Uncover and add the toasted almonds, scallions, olives, honey, lemon juice and 1 teaspoon ras el hanout. Increase the heat and bring to a boil. Cook, tossing occasionally, until the liquid is reduced and the carrots are glazed, about 5 minutes. Stir in the parsley.
Meanwhile, season the fish with the remaining 1 teaspoon ras el hanout and 1/2 teaspoon salt. Heat the remaining 1 tablespoon olive oil in a large nonstick skillet over high heat. Add the fish, skin-side down, and cook, flipping once, until just cooked through, 5 to 6 minutes; season with salt. Remove from the heat and let the fish rest 2 minutes in the hot skillet. Serve with the carrots.
Photograph by Charles Masters","['1/4 cup sliced almonds', '3 tablespoons extra-virgin olive oil', '1 1/2 pounds carrots, cut into sticks', '1/2 cup dried apricots, quartered', '4 scallions, chopped', '1/4 cup thinly sliced pitted green olives', '1 tablespoon honey', 'Juice of 1/2 lemon', '2 teaspoons ras el hanout (Moroccan seasoning)', '1/4 cup chopped fresh parsley', '4 skin-on center-cut arctic char fillets (about 6 ounces each)', 'Kosher salt']",Spiced Char with Moroccan Carrots
"Heat butter and olive oil in a 3- to 4-quart Dutch oven or heavy-bottomed saucepan with a tight fitting lid over medium heat. When oil shimmers, add onion, garlic, cumin, and cinnamon, and season with salt and freshly ground black pepper. Cook, stirring occasionally, until spices are aromatic and onions are soft and translucent, about 5 minutes.
Add squash and potatoes, season with salt and freshly ground black pepper, stir to coat, and cook until just tender, about 3 minutes. Add broth, chickpeas, tomatoes and their juices, and saffron, if using. Bring mixture to a boil then reduce heat to low. Cover and simmer until squash is fork tender, about 10 minutes.
Remove from heat and stir in preserved lemon and olives. Serve over couscous garnished with cilantro, almonds, and yogurt.","['1 tablespoon unsalted butter', '1 tablespoon olive oil', '1 medium yellow onion, small dice', '4 medium cloves garlic, thinly sliced', '2 teaspoons ground cumin', '1 (3-inch) cinnamon stick', 'Salt and freshly ground black pepper', '1 pound butternut squash, large dice', '3/4 pound red potatoes, large dice', '2 cups low-sodium chicken or vegetable broth', '2 cups cooked chickpeas, drained', '1 (14-ounce) can diced tomatoes, with juices', 'Pinch saffron threads, optional', '1/2 preserved lemon, finely chopped', '1 cup brined green olives (recommend: Cerignola)', 'Steamed couscous, for serving', 'Fresh cilantro leaves, roughly chopped, for garnish', 'Toasted slivered almonds, for garnish', 'Plain yogurt, for garnish']",Squash and Chickpea Moroccan Stew
"To make the spice blend: Combine the cumin, coriander, turmeric, paprika, nutmeg cinnamon , cardamom, allspice, cayenne pepper, and ground cloves and store in an airtight container away from heat for up to several months.
Preheat the oven to 350 degrees F.
Arrange a wire cooling rack over a large baking sheet and place near a large mixing bowl. Place a bowl of warm water nearby.
In the large mixing bowl, combine the meat, bread crumbs, 1 egg lightly beaten, 2 to 3 tablespoons grated onion and juice, 2 cloves minced garlic, mint, cinnamon, nutmeg, salt, pepper, and a liberal drizzle of extra-virgin olive oil, about 2 tablespoons. Roll the meat into walnut-size balls with dampened hands (use the bowl of warm water) and arrange the meatballs on the wire rack set over baking tray. Roast the meatballs until cooked through, 20 to 25 minutes.
Meanwhile, heat more extra-virgin olive oil, a turn of the pan, in a Dutch oven over medium to medium-high heat. Add the chopped onion to the pan with the sliced garlic, and zucchini. Cook 7 to 8 minutes, then add the diced tomatoes, tomato sauce, honey, and spice blend, and bring to a bubble. Drain the chickpeas and stir into the sauce. Remove the meatballs from the oven and slide into the sauce. Cool completely and store for make-ahead meal.
To serve, reheat the meatballs in the sauce. Use about 1 cup water to loosen up the sauce, if necessary. Make 4 wells in the sauce and drop in the 4 freshly cracked eggs. Cover the pot and simmer to poach to desired doneness. Scoop the meal into shallow bowls and stir the egg into the meatballs and sauce as you eat.","['1 tablespoon ground cumin', '1 tablespoon ground coriander', '1 tablespoon turmeric', '1 tablespoon paprika', '1 1/2 teaspoons freshly grated nutmeg', '1 teaspoon ground cinnamon', '1 teaspoon ground cardamom', '1 teaspoon ground allspice', '1 teaspoon cayenne pepper', '1/2 teaspoon ground cloves', '1 pound ground lamb or beef', '2 slices good quality stale bread, crusts removed, processed into fresh bread crumbs', '5 eggs, 1 for meatballs, 4 for poaching and serving, optional', '1 medium onion, 1/4 onion grated and juiced, 3/4 onion, chopped', '4 large cloves garlic, 2 minced or pasted, 2 sliced', '1 small handful fresh mint leaves, leaves picked and finely chopped', 'Pinch ground cinnamon', 'Few grates nutmeg', 'Kosher salt and freshly ground black pepper', 'Extra-virgin olive oil, for liberal drizzling', '1 small zucchini, sliced on an angle or chopped', '1 (28-ounce) can diced tomatoes', '1 (8-ounce) can tomato sauce', '1 tablespoon honey', '1 tablespoon Spice Blend or Ras el hanout', '1 (14-ounce) can chickpeas', 'A handful cilantro, leaves picked and chopped']",Moroccan Meatballs with Eggs
"In a medium bowl, combine shredded carrots, diced cucumber and raisins. Set aside.
For the Dressing: In a small mixing bowl, combine lemon juice, cilantro, spices, and honey. Slowly whisk in extra-virgin olive oil.
Pour dressing over carrot salad and toss to coat. Cover with plastic wrap and refrigerate for several hours to allow flavors to meld.","['2 (10-ounce) packages pre-shredded carrots', '1 cucumber, seeded and chopped', '1 cup golden raisins', '1 lemon, juiced', '1/2 cup, chopped cilantro leaves', '1 teaspoon ground cumin', '1/2 teaspoon paprika', '1 pinch cayenne', '1 teaspoon honey', '1/4 cup extra-virgin olive oil']",Moroccan Carrot Salad
"In a large bowl combine the beef, onion, garlic, parsley, coriander, mint, marjoram, salt, pepper, cumin, paprika and cayenne. Cover and let sit for one hour. Soak 12 wooden skewers in water for one hour.
In a separate bowl combine cucumber, tomato, bell pepper, hot pepper, garlic, mint, red wine vinegar, olive oil, salt and pepper tossing to combine. Cover and let marinate at room temperature until ready to serve.
Preheat grill or broiler.
Dip hands into a bowl of water. Shape and pack about a 1/3 cup of the meat mixture into 2 sausage-shapes on a soaked wooden skewer. Repeat procedure for remaining meat and skewers.
Grill the keftas on both sides until cooked through, about 3 to 4 minutes per side. Serve hot with chopped salad.","['1 1/2 pounds ground beef', '1/2 cup grated onion', '2 cloves garlic, finely minced', '2 tablespoons finely chopped fresh parsley', '2 tablespoons finely chopped fresh coriander', '3 teaspoons finely chopped fresh mint or 1 teaspoon dried mint', '2 teaspoons finely chopped fresh marjoram or 1/2 teaspoon dried marjoram', 'Salt and freshly ground black pepper', '1/2 teaspoon ground cumin', '1/2 teaspoon paprika', '1/4 teaspoon cayenne', '1 seedless cucumber, peeled and finely diced', '1 large tomato, seeded and finely diced', '1 green bell pepper, seeded and finely diced', '1 hot Italian-style pepper, seeded and finely diced', '2 cloves garlic, finely minced', '3 tablespoons finely chopped fresh mint', '2 tablespoons red wine vinegar', '2 to 3 tablespoons olive oil']",Moroccan Beef Kefta on Skewers with Chopped Vegetable Salad
"Combine the orange-flavored liqueur, gin and mandarin liqueur in a cocktail shaker with ice. Strain into a rocks glass filled with ice, then add a splash club soda and garnish with and orange slice and mint sprig.","['1-ounce orange-flavored liqueur (recommended: Cointreau)', '1-ounce gin', '1-ounce mandarin liqueur (recommended: Marie Brizard Mandarin Liqueur)', 'Ice cubes', 'Orange flavored club soda', 'Orange slice', 'Mint Sprig']",Moroccan Cocktail Spritzer
"Watch how to make this recipe.
Season both sides of tilapia fillets with salt and black pepper. Rub cumin and coriander all over both sides of fillets. Heat oil in a large skillet over medium heat. Add tilapia fillets and cook 3 to 5 minutes per side, until fish is fork-tender. Meanwhile, in a small bowl, combine mango and cilantro. Top tilapia with mango mixture just before serving.","['Four 5-ounce tilapia fillets', 'Salt and ground black pepper', '2 teaspoons ground cumin', '2 teaspoons ground coriander', '1 tablespoon olive oil', '1 ripe mango, diced', '1/4 cup chopped fresh cilantro leaves']","Moroccan-Style Tilapia with Cumin, Mango and Cilantro"
"Boil water. Pour a small amount in teapot and swish around to warm the pot. Combine the mint and green tea and sugar in the teapot, then fill it with the rest of the hot water. Let tea brew, stirring the leaves once or twice, for 3 minutes. Pour tea through a tea strainer into glass teacups to serve. Garnish with remaining 4 sprigs of mint.","['10 fresh mint sprigs, plus 4 for garnish', '3 teaspoons green tea', '3 tablespoons sugar', '4 cups water']",Moroccan Mint Tea
"Wash and pat the chicken dry. Combine the cumin, coriander, ginger, paprika and cinnamon in a large plastic bag. Season the spice blend with pepper and a little salt (remember the olives will be salty so go easy). Add the chicken pieces to the bag and toss to coat evenly. Set aside in the refrigerator to marinate for 1 hour.
Set a large Dutch oven over medium-high heat and coat with olive oil. Brown the chicken in two batches, and then transfer to a platter. Add a little more oil to the pot and cook the garlic and onions until browned and translucent. Add the chicken back to the pot along with the lemon peel, thyme, bay leaf and saffron if using. Add the chicken broth, bring to a boil, and then reduce the heat, cover and simmer for 15 minutes.
Stir the chicken pieces, and add the olives and dates. Cover and cook until the chicken is very tender, 30 minutes longer. Remove the thyme and bay leaf before serving.
Serve the chicken with the pan sauce on a bed of the finely shredded cabbage on top of a whole toasted pita (cut in wedges, but still set on plate as a whole round pita, like a tostada). Garnish with the pistachios and chopped cilantro if using. Drizzle with the Tahini Sauce. Pair with a pinot grigio.
Combine the yogurt, tahini, honey, lemon juice and garlic in a food processor, or mix together well in a large bowl until well combined and completely smooth. Thin with water as desired. Season with salt and pepper.","['4 chicken thighs and 4 chicken leg pieces (3 to 4 pounds total)', '1 tablespoon ground cumin', '2 teaspoons ground coriander', '2 teaspoons ground ginger', '2 teaspoons paprika', '1/2 teaspoon ground cinnamon', 'Kosher salt and freshly ground black pepper', 'Extra-virgin olive oil', '4 cloves garlic, crushed', '1 medium yellow onion, diced', '2 strips fresh lemon peel', '2 sprigs fresh thyme', '1 bay leaf', 'Pinch saffron threads, optional', '1 cup low-sodium chicken broth', '1 cup pitted green olives', '1/2 cup dried pitted dates', '4 cups finely shredded green cabbage', '4 to 6 whole wheat pitas, toasted', '1/2 cup chopped roasted pistachios, optional', '1/4 cup chopped fresh cilantro, optional', 'Tahini Sauce, recipe follows:', 'Pinot grigio, for serving', '3/4 cup plain yogurt', '1/2 cup tahini', '2 teaspoons honey', '1 teaspoon lemon juice', '1/2 clove garlic, minced', 'Kosher salt and freshly ground black pepper']",Moroccan Chicken with Shredded Cabbage and Tahini Sauce on Pita
