instructions,ingredients,title
"Make the herb sauce: Puree the parsley, lemon juice, tahini, honey and garlic with 1 teaspoon salt, 1/2 teaspoon pepper and 1/4 cup water in a blender.
Make the burritos: Wrap the tortillas in a damp kitchen towel and heat in the microwave until pliable, about 1 minute. (Alternatively, warm individual tortillas in a large dry skillet.)
Place 1/2 cup rice in the middle of each tortilla and scatter about cup cheese on top. Spoon a quarter of the stew over the cheese. Fold in the two sides of each tortilla and roll into a tight burrito. Serve with the herb sauce.
Combine the allspice and 3 teaspoons salt in a small bowl. Season the turkey thighs with half the salt mixture in a 5-quart slow cooker.
Toss the squash, chickpeas, tomatoes, apricots, raisins, carrots, onions and chiles with the remaining spiced salt. Pour the vegetables over the turkey (the cooker will be full; arrange the mixture so the lid fits). Cover and cook on high for 6 hours or on low for 7 to 8 hours.
Spoon the vegetables and broth into bowls. Remove and discard the turkey bones and place the meat on top of the vegetables.
Juice the lemon; pulse with the cilantro, parsley, garlic, cumin and 1 teaspoon salt in a food processor. Add the oil and process until smooth. Serve the stew in bowls; drizzle with the cilantro sauce.
Photograph by Antonis Achiellos","['1/2 cup fresh parsley', '1/3 cup fresh lemon juice', '1/4 cup tahini (sesame paste, available in the international foods aisle)', '2 teaspoons honey', '1 clove garlic, smashed', 'Kosher salt and freshly ground pepper', '4 10-inch flour tortillas', '2 cups cooked rice or couscous, heated', '1 1/3 cups shredded pepper or monterey jack cheese', '3 cups leftover Moroccan Turkey Stew, heated', '1 teaspoon ground allspice', 'Kosher salt', '4 skinless, bone-in turkey thighs (about 4 pounds)', '1/2 medium butternut squash, cut into 2-inch chunks', '2 15 .5-ounce cans chickpeas, drained and rinsed', '1 28 -ounce can whole peeled tomatoes with juices, broken up', '1 cup dried apricots', '1/2 cup golden raisins', '8 medium carrots, cut into 11/2-inch pieces', '3 medium red onions, halved and cut into wedges', '2 whole dried red chiles', '1/2 lemon', '2 cups fresh cilantro, including leaves and some stems', '1 cup fresh parsley', '1 clove garlic, smashed', '1/2 teaspoon ground cumin', '1/2 cup extra-virgin olive oil']",Moroccan Burritos with Tahini Herb Sauce
"Preheat the oven to 250 degrees F. Wrap the flatbread in foil and place in the oven to warm while you are making the eggs.
Heat the canola oil in a large, high-sided saute pan over high heat until it begins to shimmer. Add the sausage and cook until golden brown and just cooked through, about 3 minutes. Add the onions and cook until softened and lightly golden brown. Add the garlic and cook for 1 minute. Add the tomatoes, harissa, ras el hanout, paprika and 1 cup of water to the pan and bring to a boil. Reduce the heat to medium low and cook until the sauce thickens, about 15 minutes. Season with salt, pepper and honey, if needed.
Carefully crack the eggs over the mixture, sprinkle with the goat cheese, cilantro and parsley and cover with a lid for a few minutes. Uncover and continue to cook until the whites are set but the yolks are still runny, 1 to 2 minutes.
Serve the eggs and sauce in the pan with the warm flatbread on the side.","['4 to 6 pieces flatbread, such as pita, naan or lavash', '3 to 4 tablespoons canola oil', '12 ounces merguez sausage, casings removed', '1 medium Spanish onion, halved and thinly sliced', '2 cloves garlic, minced', 'One 28-ounce can plum tomatoes, coarsely crushed', '1 to 2 tablespoons harissa, depending on how spicy you want it', '1 tablespoon ras el hanout (Moroccan spice blend)', '1 teaspoon Spanish sweet smoked paprika', 'Kosher salt and freshly ground black pepper', 'Honey, as needed, optional', '8 large eggs', '4 ounces soft goat cheese, crumbled', '1/4 cup coarsely chopped fresh cilantro', '1/4 cup coarsely chopped fresh flat-leaf parsley']",Moroccan Eggs with Flatbread and Goat Cheese
"In a large heavy pot heat oil over medium high heat. Stir in the onion and cook for 3 minutes or until tender. Stir in spices and cook until aroma is released. Stir in carrots, potatoes and squash and toss to coat. Cook vegetables for 5 minutes. Stir in tomatoes and water. If necessary add enough water so that all the vegetables are submerged. Bring to a simmer and cook for 20 minutes. Stir in zucchini and continue to cook for 20 more minutes. Stir in the chickpeas and season with salt and pepper, Tabasco and cilantro. Serve hot with couscous and warm pita bread.","['1 tablespoon olive oil', '1 large onion, chopped', '1 teaspoon cinnamon', '1/2 teaspoon allspice', '1 teaspoon ground coriander', '2 teaspoon cumin', '1 teaspoon cayenne', '4 carrots, peeled and cut into 1"" pieces', '2 russet potatoes, peeled and cut into large chunks', '1 small butternut squash, peeled, seeded, cut into 1"" chunks', '2 cups chopped whole plum tomatoes with juices', '2 cups water', '2 small zucchini, cut into 1"" pieces', '1 15-ounce can chickpeas', 'Salt and pepper', 'Tabasco to taste', '1/2 cup chopped cilantro']",Moroccan Vegetables with Couscous
"Preheat oven to 350 degrees. In a bowl combine coriander, garlic, cumin, paprika, cinnamon, salt and pepper to taste. Add olive oil, lemon and honey. Make a paste, rub onto wings and marinade overnight. Place in pan and bake for 20 minutes. Cover chili peppers with hot water and let soak 1 hour. Drain peppers and cut into small pieces. Mash or grind to puree with garlic, lemon, vinegar and salt to taste. In a saucepan melt butter and add chili puree, combine well. Brush wings with mixture and bake an additional 10 minutes. Crisp under broiler for 1 to 2 minutes. In a saucepan combine tomatoes, garlic, cumin, coriander, paprika, cinnamon, salt and cayenne to taste. Simmer for 20 minutes over low heat. Stir in yogurt and lemon juice to taste. Transfer to serving bowl. Arrange wings on serving platter. Garnish with flat leaf parsley. Serve with sauce.;","['12 chicken wings, halved', '1 1/2 teaspoons ground coriander', '4 cloves garlic, mashed', '2 teaspoons ground cumin', '1 teaspoon sweet paprika', '1 teaspoon ground cinnamon', 'Salt and pepper', '2 tablespoons olive oil', '1 tablespoon lemon juice', '1 teaspoon honey', '1/2-ounce chili peppers', '2 large cloves garlic', '2 tablespoons lemon juice', '1 tablespoon white vinegar', '6 tablespoons butter', '1 1/2 cups pureed canned plum tomatoes', '4 cloves garlic, mashed', '1 teaspoon ground cumin', '1 teaspoon coriander', '1 teaspoon paprika', '1/2 teaspoon cinnamon', 'Salt and cayenne', '1 cup yogurt, drained', '1 teaspoon lemon juice']",Moroccan Style Chicken Wings
"Preheat the oven to 350 degrees F. Spread the pitas on a baking sheet and bake until crisp and golden, about 10 minutes. Set aside.
Meanwhile, preheat a grill to medium high. Combine the ground beef, grated red onion, 1 tablespoon each olive oil and harissa, and 1/4 teaspoon each salt and pepper in a large bowl. Mix with your hands until just combined. Form into four 1-inch-thick patties; set aside.
Whisk the lemon juice with the remaining 1 tablespoon harissa in another large bowl. Gradually whisk in the remaining 2 tablespoons olive oil. Add the tomatoes, cucumbers, herbs and sliced red onion; toss to coat. Set aside.
Brush the grill grates with oil. Grill the burgers about 4 minutes per side for medium rare. Add the lettuce and pita wedges to the salad bowl; toss. Top each serving of salad with the feta and burgers.
Photograph by Charles Masters","['2 6-inch pitas, split and quartered', '1 pound lean ground beef sirloin', '1 red onion (1/2 grated, 1/2 sliced)', '3 tablespoons extra-virgin olive oil, plus more for the grill', '2 tablespoons harissa (chile paste)', 'Kosher salt and freshly ground pepper', 'Juice of 1/2 lemon', '2 beefsteak or heirloom tomatoes (about 1 pound), cut into 1-inch wedges', '2 Persian cucumbers, sliced 1/2 inch thick', '1/3 cup chopped fresh cilantro or mint (or a combination)', '1 small heart romaine lettuce, torn', '1/3 cup crumbled feta cheese (about 2 ounces)']",Moroccan Burger Salad
"Tear open the New Mexico and guajillo chiles and discard the seeds and stems. (You may leave the seeds in if you prefer a spicy harissa.) Tear the chiles into large pieces and place them in a medium bowl. Pour 2 cups boiling water over the chiles and let stand until softened, about 20 minutes.
Put the coriander and cumin seeds in a small skillet and cook, swirling often, over medium heat, until the seeds are fragrant and lightly toasted, 2 to 3 minutes. Transfer the spices to a blender and add the oil, garlic, lemon juice and 2 teaspoons kosher salt, then puree until smooth. Using tongs, add the chiles to the blender along with 1/2 cup of their soaking liquid (discard the rest) and puree until very smooth, about 2 minutes on high. Season the harissa with pepper and set aside.
Preheat the oven to 450 degrees F.
In a large bowl, toss the cauliflower with 3/4 cup of the harissa until each floret is evenly coated. Spread the cauliflower onto a rimmed baking sheet and drizzle with a little more vegetable oil. Roast, tossing halfway through, until the cauliflower is tender and the harissa has begun to caramelize, about 40 minutes.
Transfer the cauliflower to a serving platter and sprinkle with the cilantro. Serve with the remaining 1/4 cup harissa on the side for dipping.","['5 dried New Mexico chiles (about 1 ounce)', '4 dried guajillo chiles (about 1 ounce)', '2 cups boiling water', '1/4 teaspoon whole coriander seeds', '1/4 teaspoon whole cumin seeds', '2 tablespoons vegetable oil, plus more for roasting', '3 cloves garlic, roughly chopped', 'Juice of 1/2 lemon (about 1 tablespoon)', 'Kosher salt and freshly ground pepper', '1 large head cauliflower, cut into 2-inch florets (about 8 cups)', '1/4 cup lightly packed fresh cilantro leaves']",Moroccan Harissa Roast Cauliflower
"Watch how to make this recipe.
Preheat the grill or grill pan to medium-high heat.
For the Chicken:
Combine all of the spices, sugar and salt in a large bowl. Add the cubed chicken and toss to coat. Put the chicken on the skewers and lay on the grill. Cook until the chicken is cooked through, turning often so that the spices don't burn, about 10 to 12 minutes. Arrange on a serving platter and serve with the Herb Sauce.
For the Herb Sauce:
Add the fresh herbs, spices, salt, lime juice, and honey to a blender carafe. Blend to combine and with the motor running, slowly add the olive oil. Once combined, taste and adjust the seasoning if necessary, and transfer to a serving bowl.","['1 tablespoon Hungarian paprika', '1 1/2 teaspoons ground cumin', '1/2 teaspoon ground ginger', '1/2 teaspoon ground cinnamon', '1 1/2 teaspoons sugar', '1 1/2 teaspoons kosher salt', '3 boneless, skinless chicken breasts, cut into 1-inch cubes', '5 (8-inch) wooden skewers, soaked 1 hour', '1/4 cup cilantro leaves', '1/2 cup mint leaves', '1/4 teaspoon ground cumin', '1/2 tablespoon ground ginger', '1/2 tablespoon kosher salt', '1 lime, juiced', '1 1/2 teaspoons honey', '1/2 cup olive oil']",Moroccan Chicken Skewers with Herb Sauce
"Combine the apple cider, brown sugar, salt, freshly ground black pepper, garlic, and a pinch of cinnamon. For best results put in large resealable plastic bag. Add the lamb. Turn to coat the lamb. Squeeze out the air and seal the bag. Refrigerate for 30 minutes. Preheat the oven to 350 degrees F. Remove the lamb from the refrigerator and place in a roasting pan. Roast for 10 to 15 minutes (depending on temperature of meat preferred). Remove from oven and preheat the broiler. Place 3 pear wedges on top of each piece of lamb. Place lamb under broiler for 2 to 3 minutes to allow the pears to caramelize with the brown sugar. Serve with Fried Plantains.
Fried Plantains: Vegetable oil 2 green plantains, peeled, and sliced thinly lengthwise with a mandoline Salt
Fill a deep pot halfway with oil. Heat the oil to 350 degrees F. Place plantains in hot oil and fry until golden and crisp. Remove to drain on a paper towel lined plate. Season immediately with salt.","['1 pair of ""frenched"" lamb chops', '1/3 cup apple cider', '1 teaspoon brown sugar', 'Salt and freshly ground black pepper', '2 cloves garlic, minced', '1 pinch cinnamon', '1 bosc pear, cored and cut into 6 wedges', 'Fried Plantains, recipe follows']",Moroccan Lamb Chops
"Preheat the oven to 400 degrees F.
Combine the cumin, coriander, and fennel seeds with a mortar and pestle, or slightly crush the whole seeds in a spice grinder, pulsing just until coriander is just broken; do not over process. (The spices can also be crushed using a heavy cast iron skillet.) Transfer the seeds to a small bowl, and toss with the salt and pepper.
Dip side of the salmon into the spice mixture to coat heavily. Repeat with all of the salmon cubes.
Heat a large ovenproof skillet over medium heat. Do not add any oil. Place the salmon cubes, spice side down, into the pan. Cook until the spices are dry, golden, and toasted, about 4 minutes. Immediately transfer the pan to the oven; remove when salmon is just cooked through, about 30 seconds. Transfer the salmon bites to a serving platter, and skewer with toothpicks. Serve warm Citrus Dipping Sauce.
Citrus Dipping Sauce:
2 tablespoons fresh lime juice
1 tablespoon fresh lemon juice
1/4 cup fresh orange juice
1 lime, 1 lemon, and 1 orange, zested
1/2 cup kaffir or sheep's-milk yogurt
1/2 cup plain yogurt
Coarse salt
In a small saucepan over high heat, combine the lime, lemon, and orange juices with 1/2 teaspoon of the orange zest. Boil to reduce until thick and syrupy, making about 1 tablespoon. Remove from heat, and let cool.
In a medium bowl, combine the citrus syrup and the yogurts. Mix with a spoon until well combined. Season with salt, to taste. Keep refrigerated until ready to use. Sprinkle the remaining zest over the top before serving.
Yield: 1 cup","['1 1/2 teaspoons whole cumin seeds', '1 teaspoon whole coriander seeds', '2 teaspoons whole fennel seeds', '1 teaspoon coarse salt', '1/8 teaspoon freshly ground pepper', '1 3/4 pounds salmon fillet, skin removed, cut into 3/4-inch cubes', 'Citrus Dipping Sauce, recipe follows']",Moroccan Salmon Skewers
"Special equipment: coffee grinder, Dutch oven
In a medium glass bowl, combine the spice mixture, 2 tablespoons of the olive oil, the lemon zest, lemon juice, and harissa. Add the chicken thighs and stir to coat. Cover the bowl with plastic wrap and refrigerate at least 1 hour or up to 3 hours. Warm the chicken broth and add the saffron strands, then allow to steep at least 1 hour or up to 3 hours.
Preheat the oven to 350 degrees F.
Remove the chicken thighs from the marinade. In a Dutch oven over high heat, brown the chicken thighs on both sides in 2 tablespoons olive oil, about 2 to 3 minutes per side. Set chicken aside on a plate. Reduce the heat to medium, add 1 tablespoon olive oil to the pan, and saute the onion until golden, about 5 minutes. Place the chicken thighs on top of the onions and add any accumulated juices from the plate. Arrange the zucchini and yellow squash and tomato quarters on top of the chicken and tuck in the prunes and olives. Season well with salt and pepper. Pour over the chicken broth and saffron. Cover and place on the bottom rack of the oven. Let cook undisturbed 1 1/2 to 2 hours, until the vegetables are tender and the chicken is falling off the bone. Remove from the oven and transfer the contents of the Dutch oven to a large serving dish.
Heat 2 tablespoons olive oil in a small saucepan over high heat until hot but not smoking. Add the almonds and fry until the skins begin to crackle, about 2 to 3 minutes. Pour the almonds and hot oil over the vegetables and chicken on the serving dish. Sprinkle with the chopped parsley and serve, spooning over the sauce in the dish and garnishing each plate with the lemon quarters.
Combine the spices in a coffee grinder and grind to a medium-fine powder. Add the kosher salt and pepper. Store in an air-tight container, if not using immediately.","['7 tablespoons olive oil', '1 lemon, zest grated and juiced (about 2 to 3 tablespoons juice) plus 2 lemons, quartered, for garnish', '1 teaspoon harissa', '4 skinless chicken thighs, (about 2 pounds)', '1/2 cup chicken broth', 'Pinch saffron strands', '1 large onion, chopped', '3 medium zucchini, cut into 1/2-inch half moons or chunks', '3 yellow squash, cut into 1/2-inch half moons or chunks', '3 medium plum tomatoes, quartered', '1/2 cup dried pitted prunes (about 10)', '1/4 cup black olives, pitted', 'Coarse salt and freshly cracked black pepper', '1/4 cup almonds', '2 tablespoons chopped fresh flat-leaf parsley', 'Serving Suggestion: flatbread', 'Spice Mixture, recipe follows', '1 teaspoon ground cinnamon', '1 teaspoon ground cardamom', '1/4 teaspoon ground turmeric', '1/2 teaspoon ground cumin', '1/2 teaspoon sweet paprika', '1/2 teaspoon ground ginger', '1 1/2 teaspoons kosher salt', '1/2 teaspoon cracked black pepper']",Moroccan Chicken with Squash and Dried Plums
"Char the bell and chile peppers under a hot broiler until the skins are evenly blackened. Place in a bowl and cover to cool to handle. Wipe the charred skins away with paper towels and seed the peppers. Reserve for later use.
Heat a large skillet over medium-high heat, add the oil. Sprinkle the chicken thighs with salt and pepper on both sides. Add the chicken to the hot oil and brown on both sides, 4 to 5 minutes. Remove the chicken to a plate and reduce the heat a bit. Add the garlic, bay leaf, cinnamon, ginger, onions, paprika, cumin and some salt and pepper, and cook to soften a bit, stirring occasionally. Add a splash of vinegar.
Place the peeled peppers in the bowl of a food processor with 1 cup of the stock, and process until pureed. Add the puree to the pan, thin with about 1/2 cup water and slide the chicken back into the pan. Reduce the heat to a simmer and finish cooking the chicken through. Turn off heat and cover until you serve.
To serve, heat the remaining 1 1/2 cups stock (or 1 cup stock and 1/2 cup water) and the butter to a boil with the rice. Bring to a bubble, then reduce the heat to low and cover. Simmer the rice for about 15 minutes. Turn off the heat and let stand 5 to 10 minutes, then fluff with fork.
In shallow bowls, top the rice with the chicken in spicy sauce, garnish with scallions before serving.
Get Rachael's shopping list for this episode's recipes here.","['3 red bell peppers', '3 red chile peppers such as Fresno or Holland finger peppers', '2 tablespoons olive oil', '8 boneless, skinless chicken thighs', 'Salt and pepper', '3 cloves garlic, chopped', '1 bay leaf', '1 small piece cinnamon stick or a pinch ground cinnamon', '1 inch fresh ginger root, peeled and grated or pasted', '1 onion, finely chopped', '2 teaspoons smoked sweet paprika (2/3 palmful)', '1 teaspoon ground cumin (1/3 palmful)', 'White wine vinegar', '2 1/2 cups chicken stock', '1 tablespoon butter', '1 1/4 cups basmati or other white long grain rice', 'Thinly sliced scallions, for garnish']",Moroccan Red Harissa Chicken
"Heat the oil in a large skillet over medium-high heat. Add the onions and cook, stirring occasionally, until browned, about 7 minutes. Add the chickpeas, raisins, harissa, cinnamon, cumin, 1/2 teaspoon salt and 1/4 teaspoon pepper and cook, stirring, until the spices are toasted, about 30 seconds.
Working over the skillet, rip the tomatoes into large chunks with your hands and add to the skillet; add 2 cups water. Reduce the heat to medium-low, cover and simmer until the tomatoes and chickpeas have softened, about 12 minutes. Stir in the squash and olives, cover and cook until the squash is tender, about 5 minutes. Stir gently, so as not to break apart the squash too much, and simmer, uncovered, until the sauce is slightly thickened, about 5 minutes.
While the tagine simmers, prepare the couscous according to package directions.
Remove the tagine from the heat, and stir in the cilantro. Adjust the seasoning with additional salt, pepper and harissa. Divide the couscous between four plates, and spoon the tagine over it. Serve with additional harissa on the side.","['2 tablespoons extra-virgin olive oil', '1/2 medium yellow onion, cut from root to tip into 1/4-inch-thick slices', 'One 15.5-ounce can chickpeas, strained', '1/3 cup golden raisins or chopped dried apricots', '1 tablespoon harissa or 2 teaspoons sriracha, plus more if desired', '3/4 teaspoon ground cinnamon', '3/4 teaspoon ground cumin', 'Kosher salt and freshly ground black pepper', '3 whole peeled canned tomatoes', 'One 10-oz package frozen diced butternut squash', '1/3 cup pitted green olives, smashed with the side of a knife', '1 cup couscous', '2 tablespoons chopped fresh cilantro']",Shortcut Moroccan Vegetable Tagine with Couscous
"Special equipment: 1 package wooden skewers, soaked in water for 30 minutes
Combine all spices and seasonings in a small bowl. Place lamb cubes in a shallow baking dish or large bowl. Rub spice mixture into lamb with hands. Thread lamb cubes onto skewers, about 3 per skewer.
Preheat a grill or grill pan to high heat. Grill kabobs for 3 minutes per side, or until cooked to desired doneness. Transfer to a serving platter and serve with Mint-Parsley Yogurt Sauce for dipping.
Stir together the yogurt, mayonnaise, lemon juice, and garlic in a medium bowl. Season with salt and pepper, to taste. Add the chopped fresh herbs and gently stir to combine. Cover and refrigerate until ready to serve.
Yield: about 1 1/4 cups","['1 teaspoon ground cinnamon', '1 teaspoon ground coriander', '1 teaspoon salt', '1/2 teaspoon freshly ground black pepper', '1/2 teaspoon ground cumin', '1/2 teaspoon ground nutmeg', '3 pounds boneless leg of lamb, cut into 1-inch cubes', 'Mint-Parsley Yogurt Sauce, recipe follows', '1 cup plain yogurt (2 percent or whole is best)', '1 tablespoon mayonnaise', '2 tablespoons freshly squeezed lemon juice', '2 cloves garlic, pressed', 'Salt and freshly ground black pepper', '2 tablespoons chopped fresh mint leaves', '2 tablespoons chopped fresh flat-leaf parlsey leaves']",Moroccan Lamb Kabobs
"Steep mint and tea in nearly boiling water for 3 to 5 minutes. Remove mint and tea, stir in sugar and serve immediately.;","['4 sprigs fresh mint', '3 tablespoons green tea', '3 tablespoons sugar', 'Nearly boiling water']",Moroccan Mint Tea
"Put broth in the couscousiere pot, add the onions, tomatoes, meat, parsley, olive oil, saffron, ginger and salt and pepper. Boil on medium high heat for 5 to 10 minutes. Put the keskes on top of the pot and add couscous slowly. Let the couscous steam for 1/2 hour.
After steam starts coming up, take the couscous out of keskes and transfer into a large bowl (gsaa). Break up any clumping grains of couscous with wooden spoon, and cool for a few minutes. Sprinkle 1/2 cup to 3/4 cup cold water on the couscous while it is in the bowl, to make the grains larger and soft. Return to heat and steam for another 30 minutes. Remove the couscous from the pot and transfer to the large bowl. Again, break up any clumps and sprinkle with 1/2 cup to 3/4 cup of water. Remove the meat from the couscousiere, cover and set aside. Add vegetables to the couscousiere and return the couscous to the keske and place in the couscousiere. Cook the vegetables and the couscous for 30 to 45 minutes on medium high heat. After the vegetables and couscous are all fully cooked, remove the couscousiere from heat. Return the couscous to a large bowl and add butter. Place the couscous on a platter, forming a hole in the middle of the couscous. Place meat in the hole and top with vegetables. Put sauce around sides of the platter. Serve guests additional sauce in small bowls.","['2 quarts water (or beef broth) plus 2 cups to use during couscous procedure', '1 large yellow onion, chopped', '1 large tomato, diced', '4 pounds lamb shoulder or lamb shank, cut into 2-inch pieces', '1 small bouquet parsley, approximately 1/2 cup', '1/2 cup olive oil', '1/2 teaspoon saffron', '1/2 teaspoon ground ginger', 'Salt, to taste', '1 tablespoon black pepper', '24 ounces couscous', '1 pound green and yellow zucchini cut in half lengthwise', '1 pound baby carrots', '1 pound potatoes, any kind, peeled and cut into quarters', '1/2 head cabbage, diced', '1 pound peas, fresh or frozen', '2 rutabagas, peeled and diced', '2 large turnips, peeled and cut into quarters', '1/2 cup butter, softened', '* Bay leaves and fresh thyme may also be added to the recipe', '* 2 to 3 whole jalapenos can also be added to the vegetables, then served separately']",Moroccan Couscous with Meat and Vegetables
"HEAT oil in a 2 1/2 or 3 quart saucepan over medium heat. Add onion, bell pepper and garlic. Cook just until onion is translucent. Add broth and bring to a boil.
WHISK in peanut butter and cumin. Blend well. Season with salt and pepper to taste. Add peas and bring to a boil. Stir in couscous and return to a boil, stirring constantly.
REMOVE from heat. Cover and let sit about 5 minutes or until liquid is absorbed. Fluff with a fork; serve immediately.","['2 tbsps. Crisco® Pure Canola Oil', '1/2 cup chopped onions', '1/2 cup chopped red or green bell pepper', '2 to 3 cloves garlic, minced', '1 1/2 cups chicken or vegetable broth', '1/2 cup Jif® Extra Crunchy Peanut Butter', '1/2 tsp. ground cumin', 'Salt and pepper', '1 (10 oz.) pkg. frozen peas (tiny deluxe, if possible)', '1 cup couscous']",Moroccan Peanut Couscous with Peas
