name,steps,description,ingredients
moroccan style spicy chicken   rice   25 minutes to make,"['coat chicken with the ras el hanout', 'fry the onion in butter until soft', 'add the chicken , then cook for a few mins more', 'stir in the rice and apricots , then add the stock cube with 700ml boiling water and the chickpeas', 'cover the pan and simmer for 15 mins or until the rice is tender and has absorbed most of the liquid', 'remove from heat , add parsley & mix', 'serve each portion with a sprinkle of pistachios']","this is a super quick, super tasty recipe! it will turn out best if you use the moroccan style ras el hanout as opposed to the algerian one - the moroccan version has warmer spice tones & the algerian has more earthy tones. you can add another dimension to this with a little bit of finely chopped preserved lemon.","['skinless chicken breasts', 'ras el hanout spice mix', 'onion', 'butter', 'long grain rice', 'dried apricots', 'chicken stock cube', 'chickpeas', 'flat leaf parsley', 'pistachio nut']"
moroccan style spicy pickled vegetables,"['make the marinade', 'pour the vinegar and water into a sauce pan', 'add all of the dried spices , herbs , julienned lemon zest and splenda', 'bring to a simmer and simmer on low for about 15 or 20 minutes', 'while the pickling blend is simmering bring another small pot of water to the boil', 'blanch the carrots , onions and green pepper separately , cooking the carrots about 2 minutes , the onion and green pepper about 1 minute', 'place all of the vegetables , including the tomatoes , garlic and olives into a large bowl or other vessel with a cover and gently stir to blend and evenly distribute them', 'pour the hot pickling liquid over the top', 'carefully stir so that all of the vegetables are submerged in the pickling liquid', 'cool to room temperature , about 1 hour and then cover and refrigerate', 'this needs to marinate overnight at the least but the longer it marinates the stronger and more flavorful it will become']",i love crunchy veggies & low cal options are always a plus.  this recipe from chefbarrae caught my eye as a must try.  i liked that it is diabetic friendly and think it would be picnic friendly.    this dish is easy to prepare and stores well in the refrigerator for at least a week.  i plan to try adding additional veggies such as celery and cauliflower too.,"['white vinegar', 'water', 'coriander seed', 'cumin seed', 'black peppercorns', 'fennel seed', 'brown mustard seeds', 'yellow mustard seeds', 'lemon zest', 'cinnamon sticks', 'bay leaves', 'dried thyme', 'crushed red pepper flakes', 'splenda sugar substitute', 'carrots', 'onion', 'green bell pepper', 'tomatoes', 'garlic cloves', 'stuffed green olive']"
moroccan style split pea soup,"['combine peas and water in a large pot , bring to a boil , reduce heat and simmer 30 minutes', 'add remaining ingredients and simmer 2-3 hours or until peas are soft and the soup thickens']",i found this recipe today at whole foods and thought it sounded intriguing. i made one change subbing 1 large onion for 2 leeks. i usually make pea soup with ham but this sounds delicious!,"['split peas', 'water', 'carrots', 'celery ribs', 'onion', 'garlic', 'ground cumin', 'ground coriander', 'paprika', 'dried oregano', 'bay leaves', 'salt & freshly ground black pepper']"
moroccan style turkey spaghetti   meatballs,"['meatballs', 'mix parsley , onion , spices , bread crumbs & egg with the ground turkey', 'make sure it is well mixed so that the spices are evenly distributed throughout the mixture', 'fork out 20 one inch balls', 'roll the balls into the flour until coated', 'pour enough oil to just cover the bottom of the frying pan , heat on medium heat', 'place the balls into the heated oil', 'turn frequently so they do not burn on the sides', 'cook until they are done all the way through', 'place off to the side', 'put spaghetti in a large pot of boiling water and cook as long as the packet suggests', 'mine takes 7-9 minutes', 'sauce', 'meanwhile , drain oil from the frying pan', 'add the onions , garlic and mushrooms and saute until they start to get soft which was about 5 minutes for me', 'add the tomatoes , peppers , cinnamon , cumin , turmeric and black pepper and lightly simmer for about 8 minutes stirring frequently', 'stir in the chickpeas and heat just long enough to cook through , about 3 minutes', 'stir in the fresh herbs and just mix through until they start to wilt', 'add in cooked spaghetti and stir to make sure all of the pasta is coated in the sauce', 'add in cooked meatballs and stir to make sure all of them are coated in the sauce']",we had this for our main meal last night. i rather heavily adapted it from a few others as i like meat & my wife and son like pasta & as we are trying to eat healthier i am trying to find new ways to use turkey meat instead of beef.,"['ground turkey', 'fresh parsley', 'fresh cilantro', 'red onion', 'paprika', 'cumin', 'turmeric', 'ground black pepper', 'egg', 'dry breadcrumbs', 'olive oil', 'flour', 'spaghetti', 'garlic cloves', 'mushroom', 'green pepper', 'yellow pepper', 'red pepper', 'chopped tomatoes', 'cinnamon', 'ground cumin', 'salt', 'black pepper', 'chickpeas']"
moroccan summer salad,"['in a large bowl combine oil and lemon juice', 'dice all fruit and veggies and add to bowl', 'salt and pepper to taste', 'serve at room temperature or refrigerate and serve chilled', 'best served within 24 hours']",for zaar world tour 2005,"['apples', 'green peppers', 'tomatoes', 'cucumbers', 'extra virgin olive oil', 'lemon juice', 'salt', 'pepper']"
moroccan sweet couscous,"['place couscous in a bowl and pour in the hot water , stirring as you do and set aside for 10 minutes', 'meanwhile , combine nuts , dried fruit , sugar and orange juice', 'set couscous in a sieve above a saucepan of boiling water and steam it for 10 minutes', 'rub in melted butter or margarine and then continue to steam for another 5 to 10 minutes', 'when ready to serve , mix nut and dried fruit mixture into the couscous and turn it out onto a serving dish', 'decorate with whole almonds and sprinkle with powdered sugar and cinnamon to serve']","from vegetarian quick and easy. this combination of nuts, dried fruits and fresh fruits is hard to resist. if the margarine option is used this recipe is vegan.","['couscous', 'hot water', 'butter', 'dates', 'almonds', 'mixed nuts', 'raisins', 'sugar', 'orange', 'powdered sugar', 'ground cinnamon']"
moroccan sweet potato and chickpea soup,"['heat oil in a large saucepan over medium heat , add onion and garlic and cook for 3 minutes', 'stir in spices and cook for a further 2 minutes', 'add sweet potato and carrot and sweat well for 10 minutes', 'add stock and cover , bring to the boil and simmer for 20 minutes', 'add chick peas and simmer for further 10 mins until chick peas are tender', 'blend until smooth , season well with salt and fresh black pepper and add lemon juice to taste']","an easy, velvety soup with complex delicious spice tastes, would make a wonderful start to a dinner party or a great lunch. got this off the web ages ago and can't remember the name of the site. may need more lemon juice if the potatoes and carrots are really sweet so taste at the end, and i used more spices as i like a deeper flavour.","['olive oil', 'onion', 'garlic cloves', 'ground coriander', 'ground cumin', 'chili powder', 'sweet potatoes', 'carrots', 'chicken stock', 'chickpeas', 'lemon, juice of']"
moroccan sweet potato stew,"['place the onions and garlic into a large pot with 1 / 4 cup water', 'cook , covered , over low heat until tender , about 10 to 12 minutes , adding more water as necessary to prevent scorching', 'stir in the turmeric , cinnamon , curry , cumin , nutmeg , red pepper flakes , salt and pepper', 'cook for 3 minutes', 'stir in the sweet potatoes , bell pepper , eggplant and broth', 'raise the heat to medium and bring to a boil', 'reduce heat to low and simmer , covered , for 5 minutes', 'add garbanzo beans and tomatoes , and simmer , covered , until sweet potatoes are tender , about 45 to 60 minutes , stirring occasionally', 'garnish with fresh cilantro before serving']",this is a great vegetarian side dish.,"['onion', 'garlic cloves', 'turmeric', 'cinnamon', 'curry powder', 'ground cumin', 'ground nutmeg', 'crushed red pepper flakes', 'salt', 'fresh ground black pepper', 'sweet potatoes', 'red bell pepper', 'eggplant', 'vegetable broth', 'chickpeas', 'diced tomatoes', 'fresh cilantro leaves']"
moroccan sweet potato with couscous,"['chop sweet potato , put in a pot with barely enough water to cover', 'add salt , bring to a boil , then reduce heat and simmer for 10-12 minutes until tender', 'cook couscous by placing in a bowl with equal amount of boiling water and covering immediately', 'leave to cook while potato is simmering', 'prepare ginger and lemon', 'add everything except lemon zest and couscous to water and sweet potato and keep on cooking about 2 minutes', 'stir in lemon zest', 'fluff couscous , divide between two pasta plates and top with sweet potato', 'be generous with the sauce as it will soak into the couscous and add delicious flavour']","spicy, flavourful, healthy, vegetarian, and a very easy one dish meal!  bright colours and three different textures in one dish. this is (very) slightly adapted from the recipe of the same name at cookthink.com.","['sweet potato', 'salt', 'fresh ginger', 'ground cinnamon', 'lemon', 'honey', 'chile', 'raisins', 'olive oil', 'lemon zest', 'couscous', 'boiling water']"
moroccan tagine,"['heat oil in a saucepan over medium heat', 'add the onion and garlic , stirring for a few minutes until onion is translucent', 'add chicken and lightly colour , stirring', 'remove from pan', 'add carrots , capsicum , and spices', 'stir dry to toast', 'once a nice aroma comes from the pan , add 1 / 2 cup of water', 'cook stirring occasionally for 5 minutes', 'add remaining ingredients', 'cover and simmer over a medium heat for 30 minutes until veggies are tender', 'stir frequently during cooking , to prevent catching on the bottom', 'you may need to add additional water', 'serve with couscous', 'nb: you only need to salt your eggplant if there are lots of black seeds when you cut it open', 'make sure you rinse the excess salt off and dry well in that case']","this is a real comfort dish, don't be put off by the sweet and savoury combination, it works really well. if you have a tagine, you could use it for the recipe, i however do not. serve over couscous.","['vegetable oil', 'onions', 'garlic cloves', 'boneless skinless chicken breasts', 'carrot', 'red capsicums', 'ground cumin', 'ground allspice', 'ground ginger', 'turmeric', 'cinnamon', 'salt', 'cayenne', 'water', 'eggplant', 'raisins', 'chickpeas', 'dried apricot']"
moroccan tagine of chicken with apricots,"['in a shallow non-metallic dish , mix the chicken with the crushed garlic , orange juice , 1 / 4 cup olive oil , cilantro , mint , cumin and nutmeg', 'cover , and let marinate overnight', 'in a large dutch oven , heat 2 tbs oil over med / high heat', 'halve the onion lengthwise and thinly slice it crosswise', 'add the onion and the minced garlic to the pot , and stir until softened and cooked , but not browned', 'remove from pot and set aside', 'add 1 more tablespoon of the oil and add the chicken , reserving the marinade', 'brown the chicken in the pot and then add the onions , prunes , apricots and their soaking liquid , marinade , chicken stock and salt', 'bring to a boil , then immediately lower to a simmer and cover with a lid', 'simmer for 2-2 1 / 2hours', 'towards the end , remove the lid from the pot to allow the liquid to evaporate a little', 'serve warm and sprinkled with sesame seeds , if desired']","this is one of my favorite moroccan dishes. many people stay away from making moroccan tagine dishes because they think you need a tagine pot to cook it in. this isn't so-- a dutch oven (such as a le creuset) works magnificently. the word tagine actually means ""stew"", so these tagine recipes are a reflection of the cooking method, not the pot. i cooked mine in my le creuset pot, and then served it in my tagine pot. if you've never dabbled in moroccan cooking before, you must taste this delightfully sweet and savory tagine! enjoy!","['boneless skinless chicken thighs', 'garlic cloves', 'orange juice', 'extra virgin olive oil', 'fresh cilantro', 'of fresh mint', 'ground cumin', 'ground nutmeg', 'yellow onion', 'garlic clove', 'dried apricot', 'prune', 'chicken stock', 'kosher salt']"
moroccan tagine with chicken and dates,"['for sugared walnuts: melt 1 t butter in a small saucepan and cook the walnuts over low heat until they are a shade darker and fragrant', 'set aside to cool', 'when cool , remove from the pan into a bowl and toss with the 1 t sugar', 'set aside', 'in the tagine cooking vessel , heat 1 t olive oil over medium-high heat until hot', 'salt and pepper the chicken thighs on both sides and sear until just golden brown , but not cooked through', 'set them aside', 'the thighs will have rendered some fat', 'remove enough fat to leave only 1 t fat in the pan', 'lower the heat to medium and saute the onion until translucent , about 5 minutes', 'stir in the garlic , cumin , coriander , cayenne , cinnamon , and ginger and continue to saute until the garlic is softened and the spices are toasted , about 2 minutes', 'add the cider , chicken broth , and honey and bring to a boil', 'boil the liquid for about 5 minutes , until liquid has reduced slightly', 'meanwhile , preheat the oven to 375 degrees', 'to the broth mixture , add the sweet potato , half of the chickpeas and half of the dates', 'nestle the chicken thighs in the pan and toss the remaining dates and chickpeas over the top', 'cover the vessel and place it in the 375-degree oven for 50 minutes to 1 hour , until the sweet potato and chicken thighs are cooked though', 'when cooked , remove from the oven and taste for seasoning', 'add more salt , pepper , or honey as desired', 'serve over cous-cous with sugared walnuts and yogurt on the side']","a tagine is both an cooking vessel and the dish it's prepared in, originating in africa. the conical shape of a tagine helps to baste the dish as it cooks. if you happen to have a tagine, that's great, but the dish works just as well in a medium or large covered pan. there are many variations on the dish, but in my family we like to use chicken thighs (with skin and on the bone, since they do well with the long cooking time). we've also done it with carrot in place of the sweet potatoes, and you can vary the fruit. sometimes we do golden raisins and dried apricot in place of the dates. the chile-ginger-cinnamon broth is sweet, spicy, and delicious. the sugared walnuts and yogurt are for serving. serve over cous-cous.","['walnut halves', 'butter', 'sugar', 'plain yogurt', 'chicken thighs', 'olive oil', 'salt and pepper', 'onion', 'garlic cloves', 'cumin', 'ground coriander', 'cayenne pepper', 'cinnamon', 'ground ginger', 'chicken stock', 'honey', 'apple cider', 'sweet potato', 'chickpeas', 'dates']"
moroccan tajine   for the crock pot,"['thaw lamb if using', 'trim excess fat from lamb or beef , then cut into large bite-size pieces', 'if using chicken thighs , leave whole', 'mince garlic and thinly slice onions', 'in a crock pot or other slow cooker , stir garlic with onions , cumin , paprika , ginger , cinnamon , allspice , salt , chili flakes , carrots , squash , broth and olives , if using', 'add meat', 'cover and cook on high heat for 5 hours or on low for 9 to 10 hours', 'stir in chickpeas , if using , during last 15 minutes of cooking', 'serve over couscous or with crusty bread', 'covered and refrigerated , tajine will keep for at least 2 days and can be frozen in an airtight container or resealable freezer bags', '~ lively additions ~', 'stir in 1 cup frozen peas during last 15 minutes of cooking', 'stir in sliced green onions , chopped coriander , parsley , basil or chives', 'add a little freshly squeezed lime or lemon juice for zip', 'for a snazzy touch , pour 1 / 4 cup heated dry sherry over 1 / 2 cup golden raisins', 'let stand for at least 15 minutes or overnight', 'stir into finished tajine']","in morocco, tajines, or stews, are made in shallow earthenware cooking pots called tajines. in this version, you use a crock-pot to produce a mellow yet intensely flavoured meat-and-vegetable mixture with a tender texture and enticing aroma. so, let it simmer away while you’re at work or play. see below for fun additions. from chatelaine magazine. enjoy!","['stewing lamb', 'garlic cloves', 'onions', 'ground cumin', 'paprika', 'ground ginger', 'cinnamon', 'allspice', 'salt', 'red chili pepper flakes', 'carrots', 'squash', 'chicken broth', 'green olives', 'chickpeas']"
moroccan tea,"['cover stuff with boiling water', 'let sit 5 minutes']",for zaar world tour.,"['green tea', 'sugar', 'mint leaves', 'dried orange blossoms', 'boiling water']"
moroccan tomato and capsicum salad,"['quarter the capsicums , and remove the saeeds and membranes', 'roast under a grill or in a very hot oven until the skin blackens and blisters', 'place in a paper or plastic bag for about 10 minutes', 'peel', 'chop the capsicum coarsely', 'drop the tomatoes into boiling water , count to ten , then drain and refresh in cold water', 'peel and seed , then chop coarsely', 'combine the capsicum and tomatoes in a bowl , add the combined remaining ingredients and mix well']",a salad that i like to serve with moroccan style dishes. it also goes well at a bbq. prep time doesn't include standing time for the roasted capsicum.,"['red capsicums', 'green capsicum', 'egg tomatoes', 'lemon juice', 'ground cumin', 'extra virgin olive oil', 'parsley', 'salt']"
moroccan tomato chicken with couscous,"['toss chicken in spice mix', 'heat oil in a large frying pan over moderate heat and add chicken and cook , turning for 3 minutes or until browned all over', 'remove from pan and add onion to pan and cook and stir for 3 minutes or until soft and then add tomato and 1 cup boiling water and mix well', 'add chicken and bring to a simmer , cover , cook stirring occasionally for 15 minutes', 'add zucchini and cook for 5 minutes or until chicken is cooked', 'meanwhile place couscous and stock powder in a medium heatproof bowl and stir in 1 cup boiling water , cover with plastic food wrap , set aside for 5 minutes or until liquid is absorbed and then using a fork , fluff and separate grains', 'combine parsley and zest in a small bowl and then add half the parsley mix to the couscous and toss to combine', 'spoon chicken and sauce over couscous and serve sprinkled with remaining parsley mix']",a healthy budget recipe with full of flavour from recipe+  http://www.food.com/recipe-finder/all/moroccan-spice-mix link to recipes for moroccan spice mix on food.com.,"['chicken legs', 'mixed spice', 'vegetable oil', 'brown onion', 'tomatoes', 'zucchini', 'couscous', 'chicken stock powder', 'parsley', 'lemon zest']"
moroccan tomato lentil stew  soup,"['heat oil in a large saucepan over medium heat', 'add leek , garlic , spices and tomato paste', 'cook gently , stirring , for 5 minutes', 'add remaining ingredients and simmer until the potatoes are cooked']","i always get great feedback from friends with this soup - tis my signature dish!!! the spice amounts are for a mildish soup. add more if you like it spicy. to save time, use 2 cups of tomato pasta sauce with the soup stock as the base (instead of the leek, tomatoes etc)","['oil', 'leek', 'garlic cloves', 'cumin', 'coriander', 'smoked paprika', 'chili flakes', 'tomato paste', 'chopped tomatoes', 'lentils', 'potatoes', 'chicken stock', 'bay leaves', 'salt', 'sugar', 'pepper']"
moroccan tuna briouats  stuffed pastries,"['if you are using egg roll wrappers that are 7x7 inches they need to be cut in half so they measure 3', '5x7', 'set out the frozen spring roll pastry so it can thaw', 'if using raw potatoes , peel & dice them , then boil them until just tender', 'set aside to be used later', 'if using canned diced potatoes drain the water & set aside to be used later', 'drain the water from the tuna & place in a medium bowl', 'chopped the parsley & cilantro together then add it to the tuna', 'mix the onions , olives , harissa , & spices together then add to the tuna', 'add the olive oil to the tuna & stir until all the ingredients are well blended', 'lastly , add the potatoes & carefully stir in so they do not break apart', 'put 2 tablespoons of the filling at the top of a pastry strip', 'fold over into a triangle , then fold over again & again', 'lightly brush the end of the pastry strip with egg yolk & fold closed', 'repeat the last 2 steps until all the filling is gone', 'heat the oil in a medium pan', 'once hot add about 5 triangles to the oil', 'fry until golden brown , turning once', 'repeat until all the triangles are cooked', 'variation: preheat the oven to 350 degrees & bake for 20-30 minutes', 'the pastries should be puffed & golden brown on both sides']","these pastry triangles are filled with sweet or savory fillings & deep-fried, traditionally (or the may be baked in the oven). this version is made with tuna & is my husband's favorite.","['egg roll wraps', 'spring roll wrappers', 'tuna in water', 'potatoes', 'onion', 'black olives', 'fresh parsley', 'fresh cilantro', 'harissa', 'olive oil', 'salt', 'paprika', 'cumin', 'black pepper', 'egg yolk', 'water', 'canola oil']"
moroccan tuna patties,"['combine the cooled mashed potato , drained tuna , breadcrumbs , egg , half the coriander and spices', 'mix together well', 'form into 8 patties and refrigerate for 15 minutes', 'heat oil in a frying pan over medium heat , cook for 3-4 minutes on each side or until golden', 'combine yoghurt , lemon rind and remaining coriander in a small bowl , mixing well', 'serve the patties with yoghurt sauce and a nice crisp salad']","i got this recipe from greenseas tuna. ds hates tuna and the the rest of us love tuna patties so its only when ds is not home that i can make anything with tuna in it.
this recipe is a different version of making tuna patties and even though they are a little different to the normal tuna patties, they are delicious especially served with a nice side salad!
the recipe calls for frying the patties but i cooked mine in the oven and they were fantastic!","['potatoes', 'tuna in water', 'fresh breadcrumb', 'egg', 'fresh coriander leaves', 'ground cumin', 'ground coriander', 'ground cinnamon', 'olive oil', 'natural yoghurt', 'lemon rind']"
moroccan tuna steaks,"['rinse the tuna steaks and pat dry with paper towels', 'in a small bowl , combine cumin , paprika , tumeric , anise , ginger , cinnamon , pepper flakes , salt , pepper , and lemon juice', 'lightly rub both sides of the tuna steaks with 1 tbsp olive oil', 'rub the seasoning mix on both sides of tuna steaks', 'coating them well', 'using a heavy bottomed saute pan or a cast-iron pan , warm the remaining olive oil', 'increase the heat to high and place the tuna in the pan', 'sear for 1 minute , then turn over carefully , reducing the heat to medium', 'sear the other side for 1 more minute until medium rare', 'do not overcook !', 'pour the melted butter over the tuna steaks and sprinkle with the coriander', 'serve immediately']",pan sear or grill.,"['tuna steaks', 'ground cumin', 'paprika', 'turmeric', 'ground aniseed', 'ground ginger', 'ground cinnamon', 'red pepper flakes', 'salt', 'pepper', 'fresh lemon juice', 'extra virgin olive oil', 'butter', 'fresh coriander']"
moroccan turkey  stewp,"['in a large stockpot , saut garlic and onion for 2-3 minutes', 'add ground turkey and cook', 'when the turkey is cooked about halfway , add the butternut squash and carrots and cook for about 7 minutes over medium heat , mixing and continuing to break up turkey', 'stir in all spices and cook , mixing , for 2 minutes', 'add tomatoes , raisins , water , and broth', 'bring to a boil , cover , and reduce heat to low', 'simmer approximately 20 minutes , until vegetables are softened', 'add zucchini and simmer another 5-10 minutes', 'to serve , add cup cooked couscous to each bowl and pour stew on top of couscous']","you can make this as a lower carb soup, or turn it into a stew by adding couscous!  i adapted this from a recipe i found at the ""go @ home"" magazine/website.","['ground turkey breast', 'butternut squash', 'onion', 'carrot', 'zucchini', 'raisins', 'fat-free chicken broth', 'water', 'diced tomatoes', 'garlic clove', 'cumin', 'ginger', 'cinnamon', 'salt', 'dried cilantro', 'couscous']"
