name,steps,description,ingredients
moroccan lamb shanks,"['heat some olive oil in a pan , cook lamb until browned all over , drain', 'in a large saucepan or casserole dish add some more olive oil , cook onion and garlic until onion softens , add cinnamon , cumin and coriander , stir until fragrant', 'add wine , bring to the boil , reduce heat and simmer uncovered until liquid has reduced by about half', 'add chicken stock and honey , bring to the boil , and reduce heat again', 'return lamb to the pan and either cook covered in a moderate slow oven for about 1hr 30 minutes or on a low heat on the stove for the same time', ""uncover dish and add the kumara , cook covered again for a further 50min's to 1 hr until lamb is falling of the bone"", 'remove lamb and kumara from dish cover with foil to keep warm', 'strain liquid into another pan , mix a little water with the cornflour , bring the sauce to a boil over a high heat add cornflour and stir until mixture thickens', 'to serve: i served mine over spiced couscous topped with kumara and lamb and then poured the sauce over']","this is a great dish, tastes wonderful and the thing i love about cooking shanks is that although the cooking time is long once you have it all in the pot that is it, just come and stir it a couple of times. i actually went and enjoyed a drink with my hubby that evening at our local restaurant and i didn't have to worry about the food. when we got home it was nice to know i did not have much to do add the kumara and make some couscous. i make lamb shanks all the time i really enjoy them, i would probably make them more if they were readily available. this is just another take on a more traditional lamb shank recipe. i use 4 nice size lamb shanks in this recipe or if you can only get french trimmed use 8, 2 per person as they are smaller.","['lamb shanks', 'olive oil', 'brown onions', 'garlic cloves', 'ground cinnamon', 'ground cumin', 'ground coriander', 'dry red wine', 'chicken stock', 'honey', 'kumara', 'cornflour']"
moroccan lamb stew,"['heat the oil in a very large pot', 'add the meat , ginger , mustard , coriander , cinnamon and sugar', 'brown lightly', 'add the onions and saute until translucent', 'add the soy sauces , sweet thai chilli sauce , stock and honey', 'bring to the boil', 'reduce heat , cover and simmer for 1 - 1 1 / 2 hours or until the meat is tender', 'stir frequently to prevent sticking and replensh liquids as necessary with water', 'add the butternut & sweetpotato and cook for a further 15 - 20 minutes or until cooked through and tender', 'check and adjsut seasoning', 'use the cornflour to thicken only if necessary', 'sprinkle with parsley to garnish and serve with brown rice , couscous or a selection of steamed vegetables']","i came across this recipe some years ago in a woman's magazine and it has become a huge hit with my family. it takes a while to prepare, but it is well worth it! this recipe makes quite a large batch, so you can freeze some for meals at a later stage.","['olive oil', 'lamb', 'mustard powder', 'ginger', 'coriander', 'cinnamon sticks', 'treacle', 'onions', 'soy sauce', 'thai sweet chili sauce', 'beef stock', 'honey', 'butternut squash', 'sweet potatoes', 'cornflour', 'parsley']"
moroccan lamb tagine,"['preheat oven to gas mark 7', 'cut meat from lamb shoulder in 4cm cubes', 'mix together marsala , tumeric , coriander , ginger , salt', 'rub half of this mixture into the meat', 'put meat in pot to brown', 'add sliced onions , tomatoes and garlic and some more spice', 'allow to brown', 'add saffron and water , stir for 3 4 min , add remaining spice', 'add dices sweet potato and 1 tin plum tomatoes in sauce , break up tomatoes slightly in pot', 'leave to simmer for 3 - 4 min', 'add 2 tsp cinnamon , nuts and a generous squeeze of honey , stir together', 'transfer to oven proof dish no lid', 'place in oven for 15 min then drop temperature to gas mark 3', 'cook for another 1hr', 'add sliced green beans and return to oven for another 30 minute', 'to serve:', '1 cup of cous cous pour into bowl and just cover with boiling water , cover bowl with sideplate and allow to stand 3 4 minute', 'sweet nutty butternut - 1 butternut , diced and boiled', 'chop up more of the nuts you used in the tagine , add butter , salt , pepper and cinnamon to small frying pan cook for 2 - 3 min , add tsp cinnamon and generous squeeze of honey , stir until it boils', 'pour over cooked butternut and serve immediately', '2 tbsp greek yoghurt per person , mixed with finely chopped mint', 'roughly chopped coriander leaves to finish']","i've had a couple of friends cook me lamb tagine before, but it was never quite what i was expecting.  so i found about 5 different one' s and took out the basics and added my own flavour from there.","['lamb shoulder', 'sweet potatoes', 'green beans', 'onion', 'tomatoes', 'garlic cloves', 'plum tomatoes', 'cashew nuts', 'masala', 'turmeric', 'ground coriander', 'ground ginger', 'saffron', 'salt and pepper', 'cinnamon', 'honey']"
moroccan lamb with couscous,"['toast almond slivers in dry frying pan over medium heat , tossing until golden', 'transfer to a small bowl , cool before using', 'melt butter in large saucepan , saute garlic until softened', 'add stock and saffron , bring to a boil', 'stir couscous through boiling stock , remove sauce pan from heat: cover and stand 5 minutes until all stock is absorbed', 'using a fork , seperate the couscous grains', 'preheat grill to medium , rub sersoning and oil into lamb , grill 3 - 4 minutes per side , or until cooked to your liking', 'remove from grill and set aside to rest , keep meat warm until needed', 'cook red peppers and zucchini on grill for 2 - 3 minutes per side', 'toss red peppers , zucchini , chickpeas and herbs through the warm couscous , top with sliced lamb and sprinkle with the almonds', 'enjoy !']","this recipe has been submitted for play in zwt9 - morocco. recipe from cookbook: the complete illustrated book of herbs. 

ras el hanout is a mococcan mixture of 20 or more spices and herbs that usually includes cinnamon, cloves, lavender, orris root, cloves and turmeric.

i have not tried this because it contains ingredients that i am allergic too, but it sounds wonderful.  posted here for you  to try.","['slivered almonds', 'butter', 'garlic cloves', 'chicken stock', 'saffron thread', 'quick-cooking couscous', 'ras el hanout spice mix', 'olive oil', 'lamb backstraps', 'red peppers', 'zucchini', 'canned chick-peas', 'fresh mint leaves', 'fresh coriander leaves']"
moroccan lamb with tomato   couscous,"['sprinkle the lamb with moroccan spice', 'heat the oil in a pan , add the lamb fillets and cook until the lamb is cooked as desired', 'remove the lamb to a warm serving plate', 'add the onion , garlic , red pepper and carrot to the pan and cook for 2-3 minutes', 'add the tomatoes and juice , and the baby peas , stirring to combine', 'cover and cook over a low heat for 10 minutes', 'spoon the sauce onto the prepared couscous', 'cut the lamb into slices and serve on top of the sauce']","tender lamb fillets coated with moroccan spice, panfried and served with a tomato vegetable sauce on a bed of couscous.  adapted from a recipe from the simply great meals recipe club website.","['lamb fillets', 'mixed spice', 'oil', 'onion', 'garlic cloves', 'red pepper', 'carrot', 'tomatoes', 'frozen baby peas', 'couscous']"
moroccan lemon chicken,"['in a 3-qt heavy saucepan , heat oil over moderately high heat until hot but not smoking', 'pat chicken dry and season with salt and pepper', 'cook chicken , skin sides down , until skin is deep golden brown', 'transfer chicken to a plate and reduce heat to moderate', 'add onion to pan and cook , stirring , until softened', 'add cumin , paprika , cinnamon , zest , and flour and cook , stirring , 1 minute', 'stir in broth , olives , and honey', 'return chicken to pan and simmer , uncovered , stirring occasionally , 8 minutes', 'transfer chicken to 2 plates', 'add chick-peas to sauce', 'simmer sauce 3 minutes and season with salt and pepper', 'pour sauce over chicken and sprinkle with coriander', 'serve chicken with rice']","i originally got this recipe from gourmet magazine, and served as an anniversary romantic meal.","['olive oil', 'boneless chicken breast', 'onion', 'ground cumin', 'paprika', 'cinnamon', 'fresh lemon zest', 'all-purpose flour', 'chicken broth', 'green olives', 'honey', 'canned chick-peas', 'coriander sprigs']"
moroccan lemon chicken w summer squash   gr  olives  sbd p1,"['pound chicken breast between two sheets of wax paper to 1 / 4 inches thick', 'in small bowl , combine the cumin , ginger , cinnamon , pepper , allspice , salt , and cayenne', 'finely grate zest of lemon into spice mixture , squeeze 1 t juice from lemon and add to mixture', 'add 3 t of the oil to spice mixture and stir to combine', 'heat a large non-stick skillet over medium high heat', 'add chicken , in batches if necessary', 'cook , turning , until blackened on the outside and cooked through , 3-4 minutes per side', 'transfer to a plate', 'loosely cover with foil to keep warm', 'add remaining 1 t oil to the skillet and return to medium heat', 'add reserve onion slices and cook , stirring constantly with a wooden spoon and scraping up any brown bits , 3 minutes', 'add squash , oilved , and water', 'season lightly with additional salt and pepper to taste', 'stir well', 'cover , and cook until squash is tender , 4-5 minutes', 'remove pan from heat', 'squeeze a little more lemon juice over chicken and vegetables', 'sprinkle with parsley and serve']","from most recent book. haven't tried.
while the ingredient list for this recipe may seem long, it largely features common pantry spices. when combined, these spices make up a version of ras-al-hanut, an intriguing blend that is widely used on moroccan style meats and fished. if you prefer, look for prepared ras al-hanut or another moroccan blend in the spice section of your supermarket. mixed with a little extra virgin olive oil, these spices make a wet rub that blackens while cooking, giving the chicken a nice, exotic taste.","['boneless skinless chicken breast halves', 'cumin', 'ground ginger', 'cinnamon', 'fresh ground black pepper', 'allspice', 'salt', 'cayenne', 'lemon', 'extra virgin olive oil', 'onion', 'summer squash', 'green olives', 'water', 'fresh parsley']"
moroccan lemon chicken with olives,"['in food processor , finely chop onion & garlic', 'dredge chicken in flour', 'in large skillet , heat oil over medium heat , then saute chicken & onion mixture until mixture has softened , about 10 minutes', 'stir in 1 / 2 cup water , the saffron , ginger , cumin , paprika , salt & lemon zest', 'bring to boil , then reduce heat & simmer , covered , 35 minutes', 'remove chicken from sauce & allow to cool a few minutes', 'cut chicken into small pieces , then put meat back into sauce', 'to the sauce add lemon juice , olives , cilantro & pepper , & simmer gently 5 minutes', 'while chicken is cooking , in a medium saucepan bring 3 / 4 cup of water to a boil', 'add couscous & bring back to a boil , then remove from heat & allow to sit for 5 minutes', 'spoon chicken mixture over couscous & serve']",this north african recipe was taken from the internet & tweaked slightly.,"['onion', 'garlic clove', 'chicken breasts', 'all-purpose flour', 'olive oil', 'water', 'saffron', 'ground ginger', 'ground cumin', 'paprika', 'salt', 'lemon juice', 'lemon, zest of', 'green olives', 'cilantro', 'couscous', 'black pepper']"
moroccan lemon mint couscous,"['prepare couscous according to package directions', 'when done , fluff couscous with fork and add remaining ingredients', 'stir very gently with a fork and serve']","this classic moroccan side dish couscous recipe is given a bit of crunch with some chopped toasted pecans. 
from linda larsen,your guide to busy cooks, @about.com","['instant couscous', 'lemon juice', 'olive oil', 'salt', 'white pepper', 'of fresh mint', 'pecans']"
moroccan lentil   vegetable soup,"['heat oil in medium saucepan over medium heat', 'add onion and garlic', 'cook 4 to 5 minutes or until onion is tender , stirring occasionally', 'stir in lentils , coriander , cumin , black pepper and cinnamon', 'cook 2 minutes', 'add chicken broth , celery and sun-dried tomatoes', 'bring to a boil over high heat', 'reduce heat to low', 'simmer , covered 25 minutes', 'stir in squash , bell pepper and parsley', 'continue cooking covered 10 minutes or until lentils are tender', 'top with plum tomatoes and cilantro just before serving']","not only does this taste good it’s very healthy.  this recipe is from a diabetic cook book.  lots of vegetable, and because the lentils are high in soluble fiber this is a good recipe to lower blood cholesterol.","['olive oil', 'onion', 'garlic cloves', 'dry lentils', 'ground coriander', 'ground cumin', 'black pepper', 'ground cinnamon', 'reduced-sodium chicken broth', 'celery', 'sun-dried tomato', 'summer squash', 'green bell pepper', 'parsley', 'plum tomato', 'cilantro']"
moroccan lentil and chickpea soup,"['in large heavy saucepan or dutch oven , melt butter over medium heat', 'stir in onion and celery and cook , covered , for 7-10 minutes or until onion is tender , stirring occasionally', 'add cinnamon , turmeric , salt , pepper , ginger , hot pepper sauce and saffron', 'cook , stirring , for 2 minutes', 'add tomatoes , lentils , chickpeas and broth', 'bring to boil , reduce heat , and simmer , covered , for about 40 minutes or until lentils are tender', 'stir in noodles and simmer , covered , about 7 minutes longer or until noddles are just tender', 'in bowl , whisk flour , and 1 cup water until smooth', 'whisk flour mixture into soup and simmer , stirring often , for 2-4 minutes or until soup is thickened and no raw flour taste remains', 'stir in half of the parsley and cilantro , and all of the lemon juice', 'taste and adjust seasoning , adding up to 1 / 2 tsp more salt if needed', 'garnish with remaining parsley and cilantro']","one of the best vegetable soups i've had in ages!  extremely easy to make and very cheap (leave out the saffron if you don't already have any)!  this lemony, peppery soup is traditionally enjoyed at the end of a day of fasting during the muslim holy month of ramadan.  this is a vegetarian version of the thick and aromatic soup.  more like a stew.  from the 2/2007 issue of canadian house & home.","['butter', 'onions', 'celery rib', 'ground cinnamon', 'turmeric', 'salt', 'ground pepper', 'ground ginger', 'hot pepper sauce', 'saffron', 'diced tomatoes', 'brown lentils', 'chickpeas', 'vegetable broth', 'vermicelli', 'flour', 'fresh parsley', 'fresh cilantro', 'lemon juice']"
moroccan lentil and kale stew,"['saut onions , carrot and garlic in the oil', 'add water , cumin , pepper and the lentils', 'bring to a simmer', 'cook until lentils are tender', 'about 20 minutes', 'add kale , parsley , salt and lemon juice and cook for 10 minutes longer until kale is wilted']",serve this topped with sautéed onions. other greens could be used in place of the kale. 4 servings. 45 min,"['oil', 'carrots', 'onion', 'garlic cloves', 'water', 'brown lentils', 'cumin', 'black pepper', 'kale', 'fresh parsley', 'salt', 'lemon, juice of']"
moroccan lentil salad  healthy,"['pick over lentils to remove any stones and rinse well', 'stick one onion half with the cloves', 'in a large saucepan , combine water , lentils and the onion stuck with the cloves', 'bring to a boil over medium heat', 'reduce the heat to low and simmer , uncovered , until the lentils are tender , about 20 minutes', 'discard onion', 'drain lentils and let cool slightly', 'in a bowl , combine lemon juice , olive oil , mint , cumin , coriander , salt and garlic', 'add lentils and toss to mix', 'finely chop the remaining onion half and add to the lentils along with the roasted peppers', 'chill at least 30 minutes to allow flavors to blend', 'serve at room temperature or chilled']","oh, yum, yum...i bought a big bottle of whole cloves at sam's a while ago and found this recipe to use them. it is fantastic. i pretty much followed it exactly, except for the garlic change. i also added two diced roma tomatoes. it is very healthy--low fat, with only 2 tsp olive oil!!--and authentic-tasting.","['green lentils', 'onion', 'cloves', 'water', 'fresh lemon juice', 'olive oil', 'dried mint', 'ground cumin', 'ground coriander', 'salt', 'garlic granules', 'roasted red pepper']"
moroccan lentil soup,"['remove the stems from the spinach', 'wash the leaves thoroughly , and pat dry', 'cut into thin strips', 'set aside', 'saute onion in olive oil in a large saucepan over medium-high heat , stirring constantly , until tender', 'add the sliced carrot and garlic , and saute , stirring constantly , until crisp-tender', 'add the chicken broth and the next 13 ingredients', 'bring to a boil', 'partially cover , and reduce heat', 'simmer 20 minutes or until the lentils are tender', 'stir in the reserved spinach and noodles', 'cook , partially covered , 7 minutes or until noodles are done', 'remove and discard the bay leaf', 'ladle soup into individual bowls', 'top each serving with a dollop of yogurt']","i like this lentil soup because it includes a couple of veggies too.  the red lentils are specified in the recipe because they are smaller, rounder, and they do not have the seed coat of brown lentils.  however, you can substitute brown lentils if necessary.  i just love the spices in this!  this is a long list of ingredients, but it involves very little effort.  you should be able to have it on the table in an hour or so.","['spinach', 'onion', 'olive oil', 'carrot', 'garlic cloves', 'chicken broth', 'red lentil', 'tomatoes', 'green onions', 'fresh parsley', 'fresh cilantro', 'bay leaf', 'ground ginger', 'ground turmeric', 'paprika', 'ground cumin', 'ground cinnamon', 'pepper', 'salt', 'fine egg noodles', 'plain yogurt']"
moroccan lentil soup with chickpeas,"['in a large stockpot , heat oil over medium heat', 'add mirepoix and garlic', 'cook , stirring , until soft but not browned , about 5 minutes', 'stir in lentils , tomtoes , stock , coriander , cumin , turmeric , cinnamon and cayenne', 'cook , covered , about 25 minutes', 'using a stick blender , puree for about 15 seconds', 'stir in garbanzo beans and cilantro', 'add salt if desired', 'heat through and serve']",this is from a grocery store ad--here for safekeeping. i made it and found it wonderful.,"['basil oil', 'mirepoix', 'garlic', 'lentils', 'italian tomatoes', 'vegetable stock', 'coriander seeds', 'cumin powder', 'turmeric', 'cinnamon', 'cayenne pepper', 'garbanzo beans', 'cilantro', 'salt']"
moroccan lentil soup with coriander oil,"['heat the oil in a large lidded saucepan , add the onion , carrot , garlic , coriander , cumin and paprika', 'cover and sweat for 10 mins shaking the pan occasionally', 'add lentils and 3 / 4 of the stock , bring to the boil and boil rapidly for 10 mins uncovered , reduce the heat , cover and simmer for 20 minutes', 'meanwhile make the coriander oil', 'pour the oil into a liquidiser and add rest of the ingredients , blend until smooth', 'cool the soup slightly before pureeing in a liquidiser , add a little more stock if required and add salt and fresh black pepper to taste', 'reheat and serve with a swirl of the coriander oil on top']",from the women's institute book of soup that i borrowed from our local library.,"['olive oil', 'onion', 'carrot', 'garlic cloves', 'ground coriander', 'ground cumin', 'paprika', 'red lentils', 'vegetable stock', 'fresh coriander', 'garlic clove', 'sea salt', 'lemon juice', 'hot chili oil']"
moroccan lentil stew with raisins,"['heat oil in medium saucepan or dutch oven over medium heat', 'add onion , and saut 3 minutes , or until softened and translucent', 'add garlic , and cook 1 minute , or until garlic is softened , but not browned , stirring constantly', 'stir in tomatoes , soup , chickpeas , raisins , cinnamon , cumin , and red pepper flakes', 'season with salt and pepper , if desired', 'bring stew to a simmer over medium-high heat , stirring occasionally', 'reduce heat to medium-low , and simmer uncovered for 20 minutes , or until mixture is reduced and sauce has thickened , stirring often from bottom to prevent sticking', 'garnish each serving with one tablespoon yogurt']",from vegetarian times. this exotically flavored stew can be stretched to feed a crowd when ladled over rice or potatoes. per 1-cup serving: 263 cal; 11g prot; 4g fat; 49g carbs; 0mg chol; 642mg sof; 13g fiber; 11g sugars,"['olive oil', 'onion', 'garlic cloves', 'crushed tomatoes', 'lentil soup', 'chickpeas', 'raisins', 'ground cinnamon', 'ground cumin', 'red pepper flakes', 'greek yogurt']"
moroccan lentils and couscous,"['place the lentils in a medium saucepan', 'add garlic , spices , and 3 cups of water', 'bring to a boil over medium heat , stirring occasionally', 'reduce heat to low , cover , and simmer 40 minutes , stirring once halfway through cooking time', 'while lentils are cooking , bring 1 cup of water to a boil in a small saucepan', 'remove from heat , stir in couscous , cover , and set aside for 15 minutes', 'heat oil in a large nonstick skillet over medium heat', 'add onion and cook , stirring frequently , until onion is nicely browned , about 10 minutes', 'add lentils to skillet and mix well', 'remove and discard bay leaf', 'serve lentils over couscous']","this superb moroccan favorite can only be described as heavenly, with the combination of aromatic spices and crisp, brown onion adding a real spark to the subtle flavors of the lentils and couscous.","['lentils', 'garlic cloves', 'cumin', 'salt', 'pepper', 'ground cinnamon', 'bay leaf', 'water', 'vegetable oil', 'onions', 'couscous']"
moroccan liver slices,"['mix the flour , paprika , cumin , and salt in a bowl', 'add the liver pieces to the flour , mix and toss thoroughly', 'heat the oil in a skillet then add the garlic & onion', 'saute for 5-7 minutes then add in the liver slices', 'fry the liver for a couple of minutes , depending on how well done you like liver cooked', 'serve immediately topped with parsley']",i found this recipe on another site & adjusted it for my husband's taste. lamb liver can be substituted for the calf's liver.,"['calf liver', 'plain flour', 'cumin', 'paprika', 'salt', 'olive oil', 'red onion', 'garlic cloves', 'parsley']"
moroccan lucky seven vegetable inspired couscous,"['cook almonds over med heat in heavy large skillet until they are pale golden , about 4 minutes , stirring frequently to evenly toast them', 'transfer to bowl& set aside', 'add olive oil to skillet& increase heat to med-high', 'add carrots& onion , cumin& coriander , saute until veggies just begin to soften , about 3 minutes', 'add wine& cranberries / currants', 'boil until wine is reduced by half , about 3 minutes', 'add broth& peas', 'partially cover skillet , simmer until veggies are tender , about 6 minutes', 'season to taste with salt& pepper , if desired', 'stir in couscous', 'cover and remove from heat', 'let stand for 7 minutes', 'stir in allspice& almonds right before serving', 'fluff with fork& serve']","before i moved to san antonio, i used to buy this fabulous ","['sliced almonds', 'olive oil', 'carrots', 'yellow onion', 'frozen peas', 'ground cumin', 'ground coriander', 'ground allspice', 'dried cranberries', 'dry white wine', 'low sodium chicken broth', 'couscous']"
moroccan marinade,"['mix all the ingredients in a glass bowl', 'add 4 servings of the meat of your choice', 'mix to combine , cover and refrigerate for 4 hours']",wonderful savory flavors!  spice up your dinner with this quick marinade.,"['olive oil', 'cumin', 'paprika', 'sugar', 'lemon juice', 'garlic cloves', 'salt and pepper', 'cinnamon']"
moroccan marinade for grilling chicken,"['mix all ingredients in a large glass bowl', 'add 2-4 chicken breast fillets and stir until they are well coated', 'cover and refrigerate at least 2 hours , preferably overnight', 'grill or broil chicken']",a nice fresh marinade for the grill.  utilizes fresh citrus with the earthy flavors of cumin and paprika.,"['fresh cilantro leaves', 'garlic cloves', 'paprika', 'ground cumin', 'fresh lemon juice', 'chicken broth', 'chicken breasts']"
