name,steps,description,ingredients
moroccan chicken  with prunes,"['sprinkle half the spice blend over the chicken', 'heat the oil and 20g of the butter in a large saucepan or deep-sided frying pan over medium heat', 'cook the chicken in two batches for 5 minutes , or until evenly browned', 'remove from the pan , then add the onion and cinnamon stick and cook for 2-3 minutres before adding the garlic', 'return the chicken to the pan and add the lemon juice and the remaining spice blend', 'season , then cook , covered for 5 minutes', 'add the stock and prunes to the pan and bring to the boil', 'reduce the heat to medium-low and cook , uncovered , for 15 minutes , or until the chicken is cooked and the liquid has reduced to a sauce', 'before serving , stir 20g of the butter into the sauce', 'about 10 minutes before the chicken is ready , place the couscous in a heatproof bowl , add 1 1 / 2 cups of the boiling water and stand for 3-5 minutes', 'stir in the remaining butter and fluff with a fork until the butter has melted and the grains separate', 'serve with the chicken']","chicken with cinnamon and lemon, spicy and delicious.  note: i've put za'atar spice mix, because it wouldn't accept morroccan and this was the closest,  if you can buy it we have morroccan spice blend here in aus.","[""za'atar spice mix"", 'chicken thigh fillets', 'oil', 'butter', 'onion', 'cinnamon stick', 'garlic cloves', 'lemon juice', 'chicken stock', 'prune', 'couscous']"
moroccan chicken   pritikin style,"['place chicken , onions , capsicum , carrots , potatoes , tomatoes , sultanas and all seasonings', 'add enough water or stock to just cover ingredients', 'bring to the boil , reduce heat and simmer 40 mins', 'add chickpeas and zucchini and cook a further 20 minutes', 'stir in green peas then turn off heat', 'cook couscous by boiling 2 cups water , then add couscous , cover and let stand 5 minutes', 'use a fork to separate grains and fluff up']","this is a surprisingly delicious chicken dish that uses no added fat or salt, and sets off the couscous perfectly.  don't skip the sultanas even if you're not fond of them - they don't overpower the sauce but add a subtle sweetness to the whole dish.","['chicken breasts', 'onions', 'green capsicum', 'carrots', 'potatoes', 'tomatoes with juice', 'sultana', 'soy sauce', 'ground ginger', 'turmeric', 'cayenne pepper', 'saffron strands', 'water', 'chickpeas', 'zucchini', 'green peas', 'couscous']"
moroccan chicken and barley pilaf,"['in a large saucepan , saut onion and carrots in olive oil over medium heat for about 5-10 minutes until onion begins to soften', 'add garlic , cinnamon , cumin , and barley', 'stir to coat', 'add chicken broth , sherry , and bay leaf', 'bring to a boil , cover pan , and reduce heat to simmer for about 40-45 minutes , stirring occasionally , until liquid is absorbed', 'when barley is nearly done , heat butter in skillet', 'add chicken , cherry tomatoes , apples , pecans , raisins , lemon zest , lemon juice , salt and pepper', 'saut 5 minutes until heated through', 'mix with barley', 'serve with lemon wedges']",entry in rsc #10.,"['olive oil', 'red onion', 'carrot', 'pearl barley', 'garlic cloves', 'cinnamon', 'cumin', 'chicken broth', 'dry sherry', 'bay leaf', 'butter', 'cooked chicken', 'cherry tomatoes', 'apple', 'pecans', 'golden raisin', 'lemon zest', 'lemon, juice of', 'salt and pepper', 'lemon wedges']"
moroccan chicken and couscous,"['heat oil in large deep skillet over medium high heat', 'sprinkle chicken with salt and cook 5 minutes , turning once , until browned', 'add broth , tomatoes , squash , raisins , cumin , cinnamon and paprika', 'bring to boil , cover and reduce heat', 'simmer 15 minutes or until chicken is tender', 'stir in couscous and peas and bring to a boil', 'cover , remove skillet from heat and let stand about 5 minutes']",a one-pot meal great for a chilly evening. based on a magazine recipe.,"['olive oil', 'chicken thighs', 'salt', 'chicken broth', 'tomatoes', 'butternut squash', 'raisins', 'cumin', 'cinnamon', 'paprika', 'couscous', 'peas']"
moroccan chicken and couscous soup,"['in a large pot , heat the oil over moderate heat', 'add the onion and cook , stirring occasionally , until translucent , about 5 minutes', 'increase the heat to moderately high', 'add the chicken , cayenne , cumin , salt , and pepper to the pot', 'cook , stirring occasionally , for 2 minutes', 'stir in the sweet potato , zucchini , tomato puree , water , and broth', 'bring to a boil', 'reduce the heat and simmer , stirring occasionally , until the vegetables are tender , about 10 minutes', 'add the couscous to the soup', 'simmer for 5 minutes , stirring occasionally', 'remove the pot from the heat', 'let the soup stand , covered , for 2 minutes', 'add the parsley and serve']","quick from scratch soups & salads - food & wine. wine: soup with such a riot of flavors needs a wine that's big but simple. try a california zinfandel here for its generous, spicy fruit, supple texture, and full body. berry-flavored zinfandel.","['cooking oil', 'onion', 'boneless skinless chicken thighs', 'cayenne', 'ground cumin', 'salt', 'fresh ground black pepper', 'sweet potato', 'zucchini', 'tomato puree', 'water', 'low sodium chicken broth', 'couscous', 'fresh parsley']"
moroccan chicken and date tagine,"['cut the dates in half , discard the stone and then chop into six pieces', 'slice the chicken into short strips', 'heat two tablespoons of olive oil in a frying pan and stir in the onion', 'cook until slippery and soft , then add in the pine kernels and lemon zest , salt and pepper', 'turn down the heat and cook for about five minutes , before adding in the chicken', 'cook until the meat is lightly browned', 'squeeze the juice from half the lemon over the top , stir in the harissa , stock and dates', 'simmer for 10-15 minutes , stirring occasionally , until the water is reduced by half', 'you should end up with a thick , rusty coloured sauce', 'meanwhile , prepare the couscous by placing it in a bowl and adding 300ml boiling water , remaining olive oil and salt', 'cover and leave for 15 minutes , then use a fork to loosen the grains and mix in the butter', 'serve the chicken mixture over the couscous , garnished with some chopped coriander and a lemon wedge']",a taste of african cuisine...,"['red onion', 'lemon', 'dates', 'boneless skinless chicken breasts', 'olive oil', 'pine nuts', 'salt and pepper', 'harissa', 'chicken stock', 'couscous', 'butter', 'coriander']"
moroccan chicken and lentils,"['combine 8 cups water and 1 teaspoons of the salt in a heavy large saucepan over low heat', 'add the lentils and bring to a boil', 'cover , reduce heat to medium and simmer about 20 to 25 minutes , or until lentils are tender but not mushy', 'drain , rinse with cold water , then drain well again', 'transfer to a large bowl', 'whisk together the 1 cup of olive oil , red wine vinegar , cumin , chili powder , garlic and salt', 'pour 1 cup of this dressing over the warm lentils and toss gently', 'allow to cool', 'in a large skillet , heat 2 tablespoons olive oil and saute onions until dark brown and soft , about 5 to 10 minutes', 'add chicken and saute 2 minutes', 'add 1 teaspoons salt , the cumin , chili powder and cinnamon', 'saute until chicken is cooked through , about 5 more minutes', 'arrange lentils on a large platter and place sliced chicken on top', 'drizzle with remaining dressing and sprinkle with the fresh parsley']","i clipped this recipe from the january 2004 bon appetit, and just got around to trying it... we absolutely loved it and i can't wait to make it again. it's really a quick and easy weeknight supper, and it makes the kitchen smell luscious! since this serves 12, i cut the recipe by 1/4 when i made it (and it fed two happy people), but i'll include the original measurements and serving size here.","['water', 'salt', 'dried lentils', 'olive oil', 'red wine vinegar', 'ground cumin', 'chili powder', 'garlic', 'onion', 'boneless skinless chicken breast halves', 'ground cinnamon', 'fresh parsley']"
moroccan chicken and olives,"['combine chicken with spices in large bowl', 'stand covered , for 1 hour', 'heat 2 tablespoons oil in a large pan', 'cook chicken until well browned , but not cooked through', 'transfer to larger pan', 'add remaining oil to pan', 'add onion and red pepper', 'cook over low heat for 5 minutes , stirring', 'transfer to large pan with chicken pieces', 'add coriander and stock , lemon rind , juice and olives', 'simmer , covered , for 40 minutes , until tender and liquid has reduced', 'thicken sauce with cornflour if desired', 'serve over rice']",posting for zwt6 north africa/middle east region. found this on world-recipes.info,"['chicken pieces', 'ground cinnamon', 'ground ginger', 'ground turmeric', 'sweet paprika', 'ground pepper', 'olive oil', 'onions', 'red pepper', 'fresh coriander', 'chicken stock', 'lemon rind', 'lemon juice', 'green olives']"
moroccan chicken and raisins for 2,"['1', 'in a 3 quart sauce pan saute onion and garlic in oil', 'add ginger , coriander , cumin , cinnamon , nutmeg and cayenne', 'simmer for a minute', 'stir in tomatoes , almonds , raisins , chickpeas and vanilla', 'add chicken', 'put your burner as low as it will go', 'let cook for 1 hour or until chicken is done']",i make this in a 3 quart saucepan but if you a have small tagine or slow cooker use it. you can use boneless thighs too.,"['oil', 'onion', 'garlic clove', 'salt and pepper', 'ground ginger', 'coriander', 'cumin', 'cinnamon', 'nutmeg', 'cayenne', 'vanilla extract', 'tomatoes', 'raisins', 'almonds', 'chickpeas', 'boneless skinless chicken breast']"
moroccan chicken and summer squash salad,"['heat grill to high', 'stir together cumin , coriander , salt , and pepper in a small bowl', 'place squash , zucchini , 1 tbs of the olive oil , and 1 tsp of the cumin mixture in a large bowl and toss to coat vegetables', 'sprinkle chicken with 2 tsp of the cumin mixture', 'whisk together lemon zest , lemon juice , and remaining cumin mixture in another large bowl', 'whisk in remaining olive oil and the parsley', 'set aside', 'grill chicken , turning once , until juices run clear , 10 minutes', 'at the same time place squash and zucchini in a grill basket and grill until crisp-tender , 4 minutes', 'let chicken cool slightly , cut into thin slices , and place in a bowl with zucchini , squash , and 2 tbs of the dressing', 'toss to coat', 'toss lettuce with remaining dressing and divide among four serving plates', 'top with chicken , squash , and zucchini']",nice salad.,"['ground cumin', 'ground coriander', 'kosher salt', 'fresh ground pepper', 'yellow squash', 'zucchini', 'olive oil', 'boneless skinless chicken breast halves', 'lemon', 'lemon juice', 'flat leaf parsley', 'bibb lettuce']"
moroccan chicken and veggie skillet,"['place fennel seeds on a cutting board and break them by cutting once or twice with a large , heavy knife', 'or if you have a mortar and pestle , give them a couple of grinds to lightly crush and release the aroma', 'in a small bowl , mix crushed fennel seeds , cumin , cinnamon and cayenne', 'set aside', 'in a large nonstick frypan , heat oil over medium high heat', 'brown chicken with onion and garlic about 5 minutes', 'stir in fennel mixture and saut 1 minute', 'add broth , zucchini , carrots , raisins and salt', 'bring to a boil', 'cover and simmer over low heat stirring once , 5 minutes or until veggies are tender', 'dissolve cornstarch in 1 tablespoon water , stir cornstarch mixture into pan and cook until thickened', 'serve over prepared couscous or rice and garnish with chopped coriander']","quick cooking chicken stew, wonderfully fragrant with moroccan spices. serve over couscous for an authentic meal. from heart healthy cooking by becel","['fennel seed', 'ground cumin', 'ground cinnamon', 'cayenne pepper', 'vegetable oil', 'boneless skinless chicken breasts', 'onion', 'garlic cloves', 'reduced-sodium chicken broth', 'zucchini', 'carrots', 'raisins', 'salt', 'cornstarch', 'fresh coriander']"
moroccan chicken and whole grain couscous,"['prepare the couscous according to package directions', 'heat the oil in a large pot over medium heat , and cook until tender', 'mix in bay leaves , cloves , cinnamon , turmeric , and cayenne pepper', 'place chicken in the pot , and cook until well browned', 'pour garbanzo beans , tomatoes , and broth into the pot , and bring to a boil', 'reduce heat to low , and simmer 25 minutes', 'mix carrots and zucchini into pot', 'season with salt', 'continue cooking 10 minutes , or until vegetables are tender', 'serve stew over cooked couscous']","a flavorful chicken stew that uses exotic spices and nice vegetables served over whole-grain couscous.  this recipe was actually a real chicken contest winner!  vegetables and even meat can vary according to taste, but i find squash, carrots, bell pepper, and lamb work well in this recipe.  even though the spices seem strange, the flavors are subtle but fragrant!  a real favorite at home.","['whole wheat couscous', 'vegetable oil', 'onion', 'bay leaves', 'whole cloves', 'cinnamon', 'turmeric', 'ground cayenne pepper', 'boneless skinless chicken breast halves', 'garbanzo beans', 'crushed tomatoes', 'chicken broth', 'carrots', 'zucchini', 'salt']"
moroccan chicken breasts,"['in large heavy skilled , heat olive oil over medium-high heat', 'sprinkle chicken with salt & pepper , then add to skillet & brown , about 7 minutes per side', 'transfer chicken to plate', 'pour off all but thin film of fat from skillet , then add onions', 'reduce heat to medium & saute until very tender & beginning to brown , about 10 minutes', 'add squash & stir 2 minutes', 'add cinnamon , cumin & saffron & stir until fragrant , about 30 seconds', 'add chicken stock & bring to boil , scrapping up browned bits', 'add chicken with any drippings on plate , kumquats , pitted prunes & honey', 'cover skillet & simmer until chicken is cooked through , turning occasionally , about 30 minutes', 'uncover & boil until liquid thickens to sauceconsistency , if necessary', 'season to taste with salt & pepper', 'mound rice or couscous on plates , then spoon shicken & sauce over', 'sprinkle with cilantro & enjoy !']",this recipe was taken from the internet while looking for looking for recipes from north africa & the middle east.,"['olive oil', 'boneless skinless chicken breasts', 'onion', 'butternut squash', 'ground cinnamon', 'ground cumin', 'saffron thread', 'low sodium chicken broth', 'kumquats', 'prunes', 'honey', 'cooked rice', 'fresh cilantro']"
moroccan chicken bundles,"['cook onion in oil with salt , cumin , ginger , turmeric , pepper and coriander in large heavy saucepan over moderate heat , stirring until onion has softened , about 5 minutes', 'add chicken , broth , water and cinnamon stick and simmer , covered , turning chicken over once , until meat is very tender , about 45 minutes', 'transfer chicken to a bowl , reserving cooking liquid', 'remove skin and bones from chicken , then shred chicken either by hand or by pulsing in food processor and place in a large bowl', 'place cooking liquid in a 2 cup glass measure and let stand 1 minute and then skim off fat and discard cinnamon stick', 'return liquid to saucepan and simmer over medium heat uncovered until liquid has reduced to about 1 / 4 cup', 'stir in shredded chicken and almonds', 'reserve 2 tbsp of beaten egg for egg wash', 'lightly season remainder of egg with salt and pepper , then cook over medium heat with 1 / 2 tbsp butter until just set , but still slightly soft', 'stir egg into chicken filling', 'put oven racks in upper and lower thirds of oven and preheat to 450 degrees', 'place 1 phyllo sheet on work surface , keeping remainder of phyllo covered with plastic wrap and damp kitchen towels', 'brush sheet generously with melted butter and then evenly sift 1 / 4 tsp cinnamon over buttered phyllo', 'top with a second phyllo sheet and generously brush with butter', 'halve buttered phyllo stack crosswise , then arrange one half with long side nearest you', 'spread 1 / 4 cup of chicken mixture in a narrow strip along edge closest to you and roll up filling tightly in phyllo , leaving ends open', 'transfer roll , seam down to a cutting board set inside a baking pan', 'make 6 more rolls in same manner', 'lightly brush top of rolls with egg wash and immediately sprinkle with mustard seeds , pressing lightly on seeds to help them adhere', 'cut each roll crosswise into 4 pieces and arrange 1 inch apart on baking sheets', 'bake , switching position of sheets halfway through baking , until phyllo is golden brown , approximately 12 minutes then transfer rolls to rack to cool slightly', 'or rolls can be assembled and cut 2 weeks ahead and frozen , wrapped well in plastic wrap', 'coat frozen rolls , then bake in preheated 350 over for about 20 minutes or so']","these moroccan-style chicken phyllo rolls have the delicious mix of moroccan spices including cumin, ginger, turmeric and cinnamon. these are great served with spiced tomato dipping sauce - moroccan style. they are a bit time consuming, but well worth it. this recipe is from another site, but was originally from gourmet magazine and is loosely based on b'stilla (a traditional moroccan dish of shredded chicken simmered with moroccan spices and then mixed with egg and nuts).","['onion', 'olive oil', 'salt', 'ground cumin', 'ground ginger', 'turmeric', 'black pepper', 'ground coriander', 'chicken thighs', 'chicken broth', 'water', 'cinnamon stick', 'sliced almonds', 'eggs', 'unsalted butter', 'phyllo pastry sheets', 'ground cinnamon', 'brown mustard seeds']"
moroccan chicken in pastry leaves,"['combine all the ingredients for the chermoula in a bowl then pour over the chicken pieces & giblets', 'rub in well and leave to marinate in the fridge for at least 2 hours', 'place the chicken pieces , giblets , & chermoula into a large tagine', 'add the water & turmeric , cover then simmer for 1 hour over medium-low heat , stirring halfway through', 'transfer the chicken , giblets , & sauce to a large bowl & remove any loose bones', 'preheat the oven to 350 degrees then mix the cinnamon & sugar together to be used later', 'pour 2 small ladles of juice from the bowl into the tagine', 'cover the bottom of the dish with 3 pastry leaves then sprinkle with 1 / 2 tsp of the cinnamon mixture', 'layer with 2 more pastry leaves , 1 ladle of juice , and 1 / 2 tsp of cinnamon mixture', 'arrange the chicken pieces on top of the pastries then cover with another 2 leaves', 'moisten with 2 more small ladles of juice then pat the pastry down around the chicken pieces with a wooden spoon', 'sprinkle another 1 / 2 tsp of cinnamon mixture on that layer & cover with the remaining 3 sheets', 'pat down as above , pour the remaining juice over the dish & sprinkle on the last of the cinnamon mixture', 'cook in the oven for 20 minutes , until the chicken is tender , then serve hot from the oven']","this dish has an interesting taste to it, spicy & sweet at the same time. the prep time does not include marinating time.","['spanish onion', 'black pepper', 'salt', 'ground ginger', 'powdered saffron', 'fresh italian parsley', 'fresh cilantro', 'olive oil', 'lemon juice', 'water', 'skinless chicken pieces', 'chicken giblets', 'turmeric', 'sugar', 'cinnamon', 'phyllo pastry sheets']"
moroccan chicken kabobs,"['cut the chicken into 1-inch cubes and place in a large , shallow , nonmetallic dish', 'put all the remaining ingredients , except parsley , in a bowl and whisk together', 'pour the marinade over the chicken cubes and toss the meat in the marinade until well coated', 'cover and let marinate in the refrigerator for 8 hours or overnight , turning the chicken 2-3 times if possible', 'if using wooden skewers , soak the skewers in cold water for about 30 minutes to prevent burning and to keep food from sticking', 'if using metal skewers , lightly brush with oil', 'preheat the broiler or grill pan', 'remove the chicken pieces from the marinade , reserving the remaining marinade and thread an equal quantity onto each prepared skewer leaving a little space between each piece', 'brush the broiler rack or grill pan with a little oil', 'add the kabobs and cook , turning frequently and brushing with the reserved marinade halfway through cooking , for 15 minutes or until browned on all sides , tender , and cooked through', 'serve hot , sprinkled with chopped parsley to garnish']",from my 100 best classic tapas cookbook -- sounds so easy yet really flavorful. prep time does not include marinating time in refrigerator.,"['chicken breast fillet', 'spanish olive oil', 'lemon, juice of', 'garlic cloves', 'ground cumin', 'ground coriander', 'hot smoked paprika', 'ground cinnamon', 'dried oregano', 'salt', 'fresh parsley']"
moroccan chicken kebabs,"['stir together yogurt , parsley , cilantro , lemon juice , oil , garlic , paprika , cumin , salt , pepper and cayenne in a medium bowl', 'add chicken and toss to coat well', 'cover with plastic wrap and marinate in the refrigerator for 20 minutes', 'meanwhile , preheat grill or broiler', 'blanch bell peppers in boiling salted water for 3 minutes', 'remove with a slotted spoon and refresh with cold water', 'blanch zucchini for 1 minute', 'drain and refresh with cold water', 'alternate chicken cubes , peppers and zucchini on skewers', 'grill or broil the kebabs until the chicken is no longer pink in the center , 3 to 4 minutes per side', 'garnish with a sprinkle of chopped parsley', 'when using wooden skewers , wrap the exposed parts with foil to keep them from burning']","posting for zwt6 and found on aol food that was provided by eating well.  this sounds very tasty without being overly spicey.  the recipe doesn't call for onions, which i would definitely add and feel free to add mushrooms, tomatoes etc.","['nonfat plain yogurt', 'fresh parsley', 'fresh cilantro', 'lemon juice', 'olive oil', 'garlic cloves', 'paprika', 'ground cumin', 'salt', 'fresh ground pepper', 'cayenne pepper', 'chicken breast', 'bell peppers', 'zucchini']"
moroccan chicken kebabs   skewers,"['cut the chicken breasts into 1 inch cubes & place in a bowl', 'add the spices to the bowl', 'stir to make sure that all the cubes are covered', 'then pour the vinegar on top & stir again', 'let marinate for at least 30 minutes', 'take the cubes & place them onto skewers', ""grill the kebabs until the chicken is done , don't over cook"", 'enjoy !']",while i was visiting my husband's family in morocco i had the pleasure of eating this wonderful chicken. when i make it for my family everyone ends up looking for more. they can't get enough.,"['boneless skinless chicken breast', 'white vinegar', 'salt', 'pepper', 'paprika', 'cumin']"
moroccan chicken legs ww,"['combine the garlic , scallion , oil , orange zest , mint , cumin , paprika , ginger and cinnamon in a zip-close plastic bag', 'add the chicken and squeeze out the air and seal the bag', 'refrigerate , 4 hours to overnight , turning the bag occasionally', 'spray the grill with nonstick cooking spray and prepare the grill to medium-hot', 'lift the chicken from the marinade and sprinkle with salt', 'discard the marinade', 'place the chicken on the grill and cover the grill until an instant read thermometer reads 180f when stuck in the thigh , about 12-15 minutes per side']","from ""everyone loves chicken"" by weight watchers. i borrowed my friend's book and i'm posting what sounds interesting for future reference. this is 5 points for each leg.","['garlic cloves', 'scallion', 'extra virgin olive oil', 'orange zest', 'dried mint', 'ground cumin', 'hot paprika', 'ground ginger', 'cinnamon', 'skinless chicken legs', 'salt']"
moroccan chicken marinade,"['mix cumin , cinnamon , paprika , coriander , cloves , ginger , salt , garlis , lemon juice , olive oil well', 'slice the chicken into whatever size piece you prefer , remembering that the larger the piece , the longer the cooking time', 'marinate the chicken in the spice mix for at least 5 mins works best if left overnight for flavours to develop', 'then fry chicken or bbq it , whatever !', 'prepare instant cous cous as per directions on packet , then once cooked , use a fork to fluff the couscous with the butter', 'add the sultanas , lemon rind and almonds to the couscous mix', 'serve the chicken on the cous cous', 'the chicken pieces also make a great addition to a green salad', 'add some chick peas to really impress']","this recipe is tasty and very simple. i always use it at dinner parties, and it always impresses. you can use beef, lamb or fish instead of chicken. it is a very versatile marinade.","['chicken breasts', 'ground cumin', 'cinnamon', 'paprika', 'ground coriander', 'ground cloves', 'ground ginger', 'salt', 'garlic', 'lemon juice', 'olive oil', 'couscous', 'butter', 'lemon, rind of', 'sultana', 'slivered almonds']"
